Nazwa,Nazwa przedsięwzięcia,Miejsce Realizacji Województwo,Grantobiorca Miejscowość,Grantobiorca Ulica,Grantobiorca Nr budynku,Grantobiorca Kod pocztowy,Wartość wsparcia
SZYMON JANKOWSKI CRAICFORD,"Wzmocnienie przedsiębiorstwa SZYMON JANKOWSKI CRAICFORD poprzez dywersyfikację, nowe produkty i usługi. Projekt realizowany w regionie wielkopolskim.",WIELKOPOLSKIE,Leszno,Wesoła,2,64-100,117429.43
RESTAURACJA HOTEL BARANOWSKI Tadeusz Baranowski ,Zwiększenie odporności przedsiębiorstwa RESTAURACJA HOTEL BARANOWSKI Tadeusz Baranowski na sytuacje kryzysowe w wyniku dywersyfikacji prowadzonej działalności (REGION 5: województwo lubuskie),LUBUSKIE,Słubice,Transportowa,4C,69-100,538715.18
BREMA Maciej Brencz ,Zwiększenie odporności przedsiębiorstwa BREMA Maciej Brencz na sytuacje kryzysowe w wyniku dywersyfikacji prowadzonej działalności (REGION 5: województwo wielkopolskie),WIELKOPOLSKIE,Poznań,Wrocławska,18,61-838,539341.76
GASTRO PROJEKT MALWINA BRENCZ," PAWEŁ MĘDREK SPÓŁKA CYWILNA,Zwiększenie odporności przedsiębiorstwa GASTRO PROJEKT MALWINA BRENCZ, PAWEŁ MĘDREK SPÓŁKA CYWILNA na sytuacje kryzysowe w wyniku dywersyfikacji prowadzonej działalności (REGION 5: województwo wielkopolskie)",WIELKOPOLSKIE,Poznań,Wrocławska,18,61-838,532950.39
MAGDALENA SZCZECHOWIAK,Zwiększenie odporności przedsiębiorstwa MAGDALENA SZCZECHOWIAK na sytuacje kryzysowe w wyniku dywersyfikacji prowadzonej działalności (REGION 5: województwo wielkopolskie),WIELKOPOLSKIE,Pniewy,Powstańców Wlkp.,1,62-045,434536.56
JEDZENIE MARZENIE FOODLY FOOD FILIP MUSZYŃSKI ,Zwiększenie odporności przedsiębiorstwa JEDZENIE MARZENIE FOODLY FOOD FILIP MUSZYŃSKI na sytuacje kryzysowe w wyniku dywersyfikacji prowadzonej działalności (REGION 5: województwo wielkopolskie),WIELKOPOLSKIE,Zalasewo,Polska,29,62-020,89650.13
LOGOS TRAVEL MAREK ŚLIWKA SPÓŁKA JAWNA,Podróżniczy zakątek kawowy – miejsce spotkań pasjonatów wypraw w Poznaniu (województwo wielkopolskie),WIELKOPOLSKIE,Poznań,Adama Mickiewicza,28,60-836,171714.54
UNU SPÓŁKA Z OGRANICZONĄ ODPOWIEDZIALNOŚCIĄ SPÓŁKA KOMANDYTOWA,"Dywersyfikacja działalności i modernizacja infrastruktury przedsiębiorstwa UNU sp. z o.o. sp.k. w regionie Wielkopolski, poprzez wprowadzenie nowych usług.",WIELKOPOLSKIE,Puszczykowo,Stefana Czarnieckiego,56,62-040,397022.63
"PRZEDSIĘBIORSTWO HANDLOWO-USŁUGOWE ""NAM"" - Z.WOLDAŃSKI"," I.KARWOWSKI SPÓŁKA CYWILNA,Zwiększenie odporności na kryzysy przedsiębiorstwa PPHU ""NAM"" - Z.WOLDAŃSKI, I.KARWOWSKI SPÓŁKA CYWILNA poprzez rozbudowę i modernizację bazy noclegowej oraz wprowadzenie nowych usług- związanych z gastronomią i salą konferencyjną, wraz z wprowadzeniem innowacyjnych rozwiązań technologicznych i ekologicznych, realizowane w Kaliszu w Regionie nr 5 obejmującym m.in. województwo wielkopolskie.",WIELKOPOLSKIE,Kalisz,Fryderyka Chopina,26,62-800,537380.95
PASTEL NATALIA BILSKA ,"Zwiększenie odporności oraz rozszerzenie i dywersyfikacja działalności przedsiębiorstwa m.in. poprzez rozbudowę oferty gastronomicznej o lody rzemieślnicze dla wegan, bezcukrowe i bezglutenowe w Regionie nr 5 obejmującym województwa wielkopolskie, dolnośląskie i lubuskie.",WIELKOPOLSKIE,Kalisz,Główny Rynek,9,62-800,539720.1
STOŁÓWKA I KAWIARNIA „POD RUMAKIEM” MARIA MAGDALENA KRZYWDA ,Zwiększenie odporności przedsiębiorstwa na sytuacje kryzysowe poprzez rozszerzenie oferowanych usług w firmie STOŁÓWKA I KAWIARNIA „POD RUMAKIEM” MARIA MAGDALENA KRZYWDA w woj. DOLNOŚLĄSKIM Region 5,DOLNOŚLĄSKIE,Strzegom,Kasztelańska,20,58-150,224335.91
ADAMSKI SPÓŁKA Z OGRANICZONĄ ODPOWIEDZIALNOŚCIĄ ,Zwiększenie odporności przedsiębiorstwa na sytuacje kryzysowe poprzez rozszerzenie oferowanych usług w firmie ADAMSKI SPÓŁKA Z OGRANICZONĄ ODPOWIEDZIALNOŚCIĄ w woj. DOLNOŚLĄSKIM Region 5,DOLNOŚLĄSKIE,Dzierżoniów,Przesmyk,9,58-200,412785.57
Firma Usługowo-Produkcyjna „GASTRONOM” Piotr Jasiak ,Rozwój Ośrodka GWAREK w Ślesinie,WIELKOPOLSKIE,Rzgów,Targowa,10,62-586,418969.95
CASTLE - ARENA KAMIL GÓRECKI,Dywersyfikacja działalności firmy CASTLE - ARENA KAMIL GÓRECKI - region dolnośląskie,DOLNOŚLĄSKIE,Brzeg Dolny,Słoneczna,5,56-120,150485.66
J&M STAWSCY SPÓŁKA Z OGRANICZONĄ ODPOWIEDZIALNOŚCIĄ,Dywersyfikacja działalności przedsiębiorstwa J&M STAWSCY SPÓŁKA Z OGRANICZONĄ ODPOWIEDZIALNOŚCIĄ - region wielkopolskie,WIELKOPOLSKIE,Jarocin,Księdza Kardynała Stefana Wyszyńskiego,4,62-200,441456.91
Dwór Niemierzyce Adrian Szukała ,"Inwestycja w dywersyfikację usług cateringowych poprzez wprowadzenie nowego rodzaju usług jakimi jest catering eventowy oraz wsparcie tych działań poprzez wdrożenie systemu informatycznego, przeprowadzenie szkoleń pracowniczych i działań zmierzających do zwiększenia energooszczędności w przedsiębiorstwie, prowadzona na terenie Regionu 5, obejmującego województwa dolnośląskie, lubuskie i wielkopolskie",WIELKOPOLSKIE,Niemierzyce,,6,62-066,138819.71
SASKIA MARIUSZ BAŁUT ,"Projekt Saskia Mariusz Bałut: Dywersyfikacja działalności przez wdrożenie nowych usług produkcji czekolady, lodów, ciast oraz cyfryzację i wprowadzenie działań proekologicznych w województwie wielkopolskim.",WIELKOPOLSKIE,Kościan,os. Osiedle Gen. Wł. Sikorskiego,5,64-000,527759.96
FENIX Roma Mężyńska ,"Rozszerzenie i dywersyfikacja działalności sali zabaw dla dzieci Monsterkowo poprzez wprowadzenie usługi cateringu, zlokalizowanego w Regionie 5 w województwie wielkopolskim",WIELKOPOLSKIE,Poznań,Piołunowa,1,61-680,171636.34
Zbigniew Kwiatkowski Katering i Gastronomia ,Dywersyfikacja działalności firmy cateringowej i uodpornienie na przyszłe kryzysy poprzez wprowadzenie do oferty organizacji imprez zewnętrznych - Region 5,WIELKOPOLSKIE,Dąbie,11 Listopada 1918 Roku,40,62-660,129000.65
ESPERANTO MACIEJ IBRON SPÓŁKA Z OGRANICZONĄ ODPOWIEDZIALNOŚCIĄ ,"Rozszerzenie działalności spółki ESPERANTO MACIEJ IBRON poprzez nową ofertę produktową oraz nowy sposób dystrybucji gotowych dań (catering) i rozpoczęcie sprzedaży przez sieciowych dystrybutorów i wykorzystanie maszyny vendingowej w województwie wielkopolskim, region numer 5.",WIELKOPOLSKIE,Poznań,Stanisława Matyi,2,61-581,532929.6
"Restauracja ""Kogucik"" Hanna Siejek","Dywersyfikacja działalności Restauracji ""Kogucik"" w Czempiniu",WIELKOPOLSKIE,Czempiń,pl. Zielony Rynek,12,64-020,500974.37
LECH SIEJEK GOSPODA POD BAŻANTEM,Dywersyfikacja działalności Gospody Pod Bażantem,WIELKOPOLSKIE,Racot,Kościańska,9E,64-000,503973.22
FOOD CONCEPT JOLANTA JURKOWLANIEC,"Dywersyfikacja działalności FOOD CONCEPT JOLANTA JURKOWLANIEC, pozwalająca na wprowadzenie nowej i ulepszonej usługi, w celu zwiększenia odporności przedsiębiorstwa na sytuacje kryzysowe, realizowana w Regionie 5: województwa dolnośląskie, lubuskie, wielkopolskie.",DOLNOŚLĄSKIE,Wrocław,ks. Konstantego Damrota,24,50-306,419379.03
MATEUSZ KANIKOWSKI EWELD EXPO SOLUTIONS ,Zwiększenie potencjału firmy MATEUSZ KANIKOWSKI EWELD EXPO SOLUTIONS w ramach wsparcia HoReCa dla MŚP z regionu wielkopolskiego.,WIELKOPOLSKIE,Poznań,os. Rzeczypospolitej,14,61-397,536491.01
Patrycja Kołacz Trener Personalny ,Rozwój oferty firmy Patrycja Kołacz Trener Personalny w zakresie usług turystycznych na obszarze gminy wiejskiej Nowa Ruda woj. dolnośląskie,DOLNOŚLĄSKIE,Wolibórz,,188d,57-431,340290.56
Siedem Drzew Emilia Sękowska,Rozszerzenie działalności firmy Siedem Drzew o nowy segment usług wellnes i Zielonej Szkoły skierowanych do nowych grup odbiorców poprzez modernizację infrastruktury hotelowej i gastronomicznej w województwie wielkopolskim.,WIELKOPOLSKIE,Biskupice,Krótka,24,62-007,539554.61
„LUDWICZAK” WIOLETTA LUDWICZAK I ANGELIKA FILIPIAK SPÓŁKA CYWILNA,Uruchomienie sali bankietowej w Jarocinie,WIELKOPOLSKIE,Parzęczew,,32A,63-233,419940
Restauracja DYNX Halina Gogulska Beata Mazela ,Rozszerzenie działalności spółki DYNX poprzez otwarcie drugiego lokalu restauracyjnego z nowymi produktami i dodatkową formą wydawania posiłków w Poznaniu w województwie wielkopolskim (region 5).,WIELKOPOLSKIE,Poznań,Ostrówek,12,61-121,386251.72
Artur Owczarek-Piotr Bryński s.c.,"Realizacja przedsięwzięcia MŚP polegająca na adaptacji dachu hotelu i wyposażenie w celu świadczenia usług spa w ramach Inwestycji A1.2.1 KPO z regionu nr 5 obejmującego województwa: dolnośląskie, lubuskie, wielkopolskie.",WIELKOPOLSKIE,Kalisz,al. Aleja Wolności,5,62-800,414000
"IWONA KACZMAREK PHU ""NIEDŹWIEDŹ"" Zespół Hotelowo-Gastronomiczny","Zwiększenie odporności na sytuacje kryzysowe i dywersyfikacja przedsiębiorstwa IWONA KACZMAREK PHU ""NIEDŹWIEDŹ"" Zespół Hotelowo-Gastronomiczny, zlokalizowanego w regionie 5 (obejmującym województwa wielkopolskie, dolnośląskie i lubuskie) poprzez utworzenie Centrum Rodzinnego Relaksu.",WIELKOPOLSKIE,Nowy Dębiec,Wczasowa,20,64-000,540000
PARTNER TARGI SPÓŁKA Z OGRANICZONĄ ODPOWIEDZIALNOŚCIĄ SPÓŁKA KOMANDYTOWA ,Zwiększenie odporności i rozszerzenie działalności PARTNER TARGI Sp. z o.o. sp. k. poprzez dywersyfikację usług świadczonych w województwie wielkopolskim,WIELKOPOLSKIE,Poznań,Bobrownicka,1C,61-306,478980.12
Delta Spółka Cywilna Jakub Bok," Barbara Połomka,Rozszerzenie zakresu działalności Delta S.C o usługi cateringu dietetycznego na terenie regionu nr 5",LUBUSKIE,Chlastawa,,18a,66-210,382676
HEJHO SPÓŁKA Z OGRANICZONĄ ODPOWIEDZIALNOŚCIĄ,Dywersyfikacja działalności spółki HEJHO Sp. z o.o. w województwie dolnośląskim w ramach zwiększania konkurencyjności gospodarki i wspierania mikroprzedsiębiorstw (Region 5 - dolnośląskie),DOLNOŚLĄSKIE,Wrocław,Babiego Lata,9,53-020,539911.8
MASSIMO SYLWIA POCHELSKA ,"Dywersyfikacja działalności firmy Massimo Sylwia Pochelska i uodpornienie na przyszłe kryzysy poprzez wprowadzenie do oferty nowych usług - Region 5 obejmujący województwa dolnośląskie, lubuskie, wielkopolskie",DOLNOŚLĄSKIE,Wrocław,Księcia Józefa Poniatowskiego,13,50-326,415760.71
„IKA” Adam Kenkel Izabela Kenkel Spółka Jawna ,Uodpornienie przez rozszerzenie i dywersyfikację działalności restauracji i hotelu Wieniawa w Lesznie (region wielkopolski),WIELKOPOLSKIE,Leszno,rynek Rynek,29,64-100,316144.36
LANCELOT SPÓŁKA Z OGRANICZONĄ ODPOWIEDZIALNOŚCIĄ ,Wprowadzenie do oferty Lancelot Sp. z o.o. Szczawno Zdrój nowych usług zwiększających odporność firmy w regionie nr 5 - województwo dolnośląskie.,DOLNOŚLĄSKIE,Szczawno-Zdrój,Nizinna,4,58-310,424709.65
"BEATA GŁOWACKA-GŁÓW PRZEDSIĘBIORSTWO WIELOBRANŻOWE ""HOLIDAYS"" ","Dywersyfikacja, zwiększenie odporności na sytuacje kryzysowe i wprowadzenie nowej usługi w firmie BEATA GŁOWACKA-GŁÓW PRZEDSIĘBIORSTWO WIELOBRANŻOWE ""HOLIDAYS"" w woj. Wielkopolskim Region 5",WIELKOPOLSKIE,Balczewo,,60a,88-100,404657.92
Grzemi Spółka z ograniczoną odpowiedzialnością ,Dywersyfikacja działalności firmy Grzemi Sp. z o.o. poprzez zakup urządzeń i modernizację obiektu w województwie wielkopolskim,WIELKOPOLSKIE,Poznań,Lutycka,34,60-415,477000
"AURELIA REŚLIŃSKA PRZEDSIĘBIORSTWO WIELOBRANŻOWE ""BEHAPOWIEC"" ","Przygotowanie działalności gospodarczej Wnioskodawcy prowadzonej w branży HoReCa do wprowadzenia nowej usługi masażu odchudzającego i relaksacyjnego mającego na celu poprawę kondycji fizycznej i poprawę samopoczucia, dedykowanej głównie osobom z niepełnosprawnościami oraz osobom starszym i nieporadnym, nie wyłączając innych zainteresowanych z możliwości korzystania, oferowanej w salonie masażu prowadzonym w Hotelu Reśliński w Grodzisku Wielkopolskim na terenie województwa wielkopolskiego.",WIELKOPOLSKIE,Grodzisk Wielkopolski,Nowa,27,62-065,408835.65
EPICENTRUM KULTURY Józef Pawlicki ,Zakup nowego projektora kinowego w celu wyświetlania filmów w projekcji 3D wraz z systemem e-Bilet i popularyzacją segregacji odpadów w województwie dolnośląskim (Region 5).,DOLNOŚLĄSKIE,Ścinawa Polska,,56a,55-200,425321.07
Rządkowska Halina," Zajazd ""Ligrana"",Modernizacja i rozbudowa infrastruktury hotelowo-gastronomicznej Zajazdu 'Ligrana' wraz z wprowadzeniem usług konferencyjnych w Regionie nr 5 obejmującym m.in. województwo wielkopolskie",WIELKOPOLSKIE,Koło,Dąbska,22,62-600,538845.2
NIETOTA SPÓŁKA Z OGRANICZONĄ ODPOWIEDZIALNOŚCIĄ,Dywersyfikacja działalności firmy Nietota sp. z o. o. w regionie 5 na terenie województwa dolnośląskiego,DOLNOŚLĄSKIE,Wrocław,Stanisława Leszczyńskiego,4,50-078,539356.83
"RESTAURACJA ""PIĘTERKO-STAROPOLSKA"" ZOFIA WROTECKA"," KAROLINA SOWA,Dywersyfikacja usług gastronomicznych w Restauracji Pięterko w województwie wielkopolskim",WIELKOPOLSKIE,Kalisz,Zamkowa,12,62-800,371399.11
RÓŻANA SPÓŁKA Z OGRANICZONĄ ODPOWIEDZIALNOŚCIĄ ,"Zwiększenie odporności firmy Różana Sp. z o.o. poprzez rozszerzenie i dywersyfikację działalności w obszarze HoReCa, prowadzonej w Różance w woj. dolnośląskim (region 5)",DOLNOŚLĄSKIE,Poznań,Gnieźnieńska,69,61-015,406189.23
AXXEDA FOOD SERVICES SPÓŁKA Z OGRANICZONĄ ODPOWIEDZIALNOŚCIĄ,Dywersyfikacja działalności spółki AXXEDA poprzez uruchomienie klubu filmowego - region 5,DOLNOŚLĄSKIE,Lubin,1 Maja,11A,59-300,540000
BIURO PODRÓŻY MEGA TOURS MARIUSZ GRABOWY ,LUBUSKIE ROWEROWE LOVE,LUBUSKIE,Zielona Góra,Stefana Żeromskiego,10,65-066,237442.1
Concordia Design Spółka z ograniczoną odpowiedzialnością,Inwestycja w dywersyfikację działalności spółki Concordia Design Sp. z o.o. w regionie nr 5 (w woj. wielkopolskim),WIELKOPOLSKIE,Poznań,Zwierzyniecka,3,60-813,442686.4
Restauracja Concordia Spółka z ograniczoną odpowiedzialnością,Inwestycja w poszerzenie działalności spółki Restauracja Concordia Spółka z ograniczoną odpowiedzialnością w regionie nr 5 (w woj. wielkopolskim),WIELKOPOLSKIE,Poznań,Zwierzyniecka,3,60-813,514186.66
Firma Wałkowscy Leon Wałkowski," Izabella Wałkowska Spółka Jawna,Inwestycja w poszerzenie oraz dywersyfikację działalności spółki Firma Wałkowscy Leon Wałkowski, Izabella Wałkowska Spółka Jawna w regionie nr 5 (w woj. wielkopolskim)",WIELKOPOLSKIE,Chodzież,Ujska,45,64-800,480293.81
BOLAN TOUR MAJA SOBOLEWSKA ,Dywersyfikacja działalność organizatora turystyki firmy BOLAN TOUR MAJA SOBOLEWSKA poprzez wprowadzenie do oferty usługi wynajmu domków wypoczynkowych – Region 5,DOLNOŚLĄSKIE,Wałbrzych,gen. Władysława Andersa,179,58-304,417093.3
Forrest Krzysztof Jakimowicz ,Rozszerzenie i dywersyfikacja działalności Forrest Krzysztof Jakimowicz na terenie województwa dolnośląskiego(Region 5).,DOLNOŚLĄSKIE,Srebrna Góra,Górne Miasto,15,57-215,334300.04
Restauracja Pyszna spółka z ograniczoną odpowiedzialnością,Dywersyfikacja działalności spółki Pyszna Sp. z o.o. w Poznaniu poprzez wprowadzenie krótkoterminowego wynajmu domków letniskowych w ramach zwiększania odporności podmiotów branży HoReCa w województwie wielkopolskim (region 5),WIELKOPOLSKIE,Poznań,Święty Marcin,11,61-803,507000
KOTLARSKA 42 KAPAŁA MARKIEL SPÓŁKA KOMANDYTOWA ,Rozszerzenie działalności firmy Kotlarska 42 Kapała Markiel sp. komandytowa o nowe produkty i usługi w regionie 5 na terenie województwa dolnośląskiego.,DOLNOŚLĄSKIE,Wrocław,Stanisława Leszczyńskiego,4,50-078,137598.95
"STANISŁAW BŁASZKOWIAK PRZEDSIĘBIORSTWO HANDLOWO-USŁUGOWE ""GAMA""",Rozbudowa i modernizacja infrastruktury Restauracji Złoty Karaś w województwie wielkopolskim - dywersyfikacja usług poprzez organizację imprez plenerowych i wprowadzenie zajęć sportowo-rekreacyjnych z zakresu wędkarstwa w Regionie nr 5.,WIELKOPOLSKIE,Lipka,,32A,62-865,539711.92
"Szynkarnia s.c. Piotr Klimczak i Spółka Piotr Klimczak, Lucyna Michalak - Klimczak, Kamil Michalak ",Dywersyfikacja działalności Szynkarnia s.c. Piotr Klimczak i Spółka w regionie 5 na terenie województwa dolnośląskiego.,DOLNOŚLĄSKIE,Wrocław,św. Antoniego,15,50-073,196598.02
Sudety 678 Paweł Soboń,Dywersyfikacja działalności firmy Sudety 678 Paweł Soboń poprzez wprowadzenie nowych usług.,DOLNOŚLĄSKIE,Szklarska Poręba,Stefana Okrzei,21c,58-580,414000
Zieliński Catering Group Maciej Zieliński ,"Zakup środków trwałych i szkolenia, celem dywersyfikacji działalności przedsiębiorstwa „ZIELIŃSKI CATERING GROUP” Maciej Zieliński z siedzibą w Szklarskiej Porębie (woj. dolnośląskie).",DOLNOŚLĄSKIE,Szklarska Poręba,Osiedle Huty,17,58-580,455064.71
Kitewyjazdy.pl Marcin Remplewicz ,Rozszerzenie działalności firmy poprzez organizowanie wyjazdów kitesurfingowych oraz wingfoilowych na wielkopolskie jeziora.,WIELKOPOLSKIE,Poznań,Katowicka,77A,61-131,391818.64
PROINVEST DEVELOPER SPÓŁKA Z OGRANICZONĄ ODPOWIEDZIALNOŚCIĄ SPÓŁKA KOMANDYTOWA ,Dywersyfikacja oraz zwiększenie odporności Hotelu Kaskada na przyszłe zagrożenia poprzez wprowadzenie do oferty dwóch nowych usług - Region V Województwo Wielkopolskie,WIELKOPOLSKIE,Poznań,Longinusa Podbipięty,9,60-177,443859.4
BAPA BORYS FROMBERG," JAKUB RUDZIK SPÓŁKA CYWILNA ,Inwestycja realizowana na terenie regionu nr 5, obejmującego województwa wielkopolskie, dolnośląskie i lubuskie, polegająca na rozszerzeniu działalności restauracji Bo znajdującej się w Poznaniu przy ul. Kościuszki 84 o usługi cateringowe świadczone na terenie województwa wielkopolskiego dla odbiorców instytucjonalnych i indywidualnych, a mająca na celu dywersyfikację działalności przedsiębiorstwa i ograniczenie skutków wpływu COVID 19 na przedsiębiorstwo,",WIELKOPOLSKIE,Poznań,Tadeusza Kościuszki,74,61-892,102648.03
HOTEL MARTA SPÓŁKA CYWILNA MARTA BERDYŚ I MARCIN BERDYŚ ,"Dywersyfikacja działalności oraz zbudowanie odporności na kryzysy w Hotelu Marta w Oławie, region dolnośląski.",DOLNOŚLĄSKIE,Oława,Gazowa,2,55-200,536921.46
CAFE DA VINCI BUSZA SPÓŁKA JAWNA,Da Vinci Cafe: Innowacyjne Centrum Wypieków i Cukiernictwa (woj. wielkopolskie),WIELKOPOLSKIE,Poznań,pl. Wolności,10,61-738,531970.92
SŁAWOMIR JOPA DW POD FORTAMI ,Dywersyfikacja i rozszerzenie działalności SŁAWOMIR JOPA DW POD FORTAMI na terenie woj. dolnośląskiego - Region 5.,DOLNOŚLĄSKIE,Srebrna Góra,Widokowa,1,57-215,91022.59
POD BOREM WARZYBOK S.C. ,Modernizacja i rozbudowa infrastruktury gastronomicznej z wprowadzeniem innowacyjnych usług SPA i rekreacji oraz instalacji fotowoltaicznych w Restauracji Eldorado i Restauracji Pod Borem Warzybok S.C. w regionie 5.,WIELKOPOLSKIE,Rzetnia,,110,63-600,478247.44
OPERATOR LECHICKA SPÓŁKA Z OGRANICZONĄ ODPOWIEDZIALNOŚCIĄ,"Dywersyfikacja działalności przedsiębiorstwa poprzez działania o charakterze inwestycyjnym, doradczym oraz szkoleniowym w regionie nr 5 obejmującym województwa: dolnośląskie, lubuskie, wielkopolskie.",WIELKOPOLSKIE,Poznań,św. Michała,67,61-005,479680.03
iSwim-Szkoła Pływania i organizacja zajęć sportowych BARTŁOMIEJ BOGULSKI,Wdrożenie nowej usługi w firmie iSwim-Szkoła Pływania i organizacja zajęć sportowych BARTŁOMIEJ BOGULSKI,DOLNOŚLĄSKIE,Wrocław,Długa,60,53-633,64195.98
Małgorzata Górska Hotel Górski ,Dywersyfikacja działalności Hotelu Górskiego Czarna Góra i uodpornienie na przyszłe kryzysy poprzez wprowadzenie do oferty usług strefy SPA wraz z działaniami towarzyszącymi,DOLNOŚLĄSKIE,Sienna,,6,57-550,227485.21
GRZEGORZ MAKAREWICZ PENSJONAT," FITNESS I SPA GREGOR,Wzmocnienie odporności i konkurencyjności przedsiębiorstwa poprzez poszerzenie zakresu oferty oraz podniesienie jakości usług Pensjonatu Gregor - województwo Lubuskie",LUBUSKIE,Zielona Góra,Chmielna,16A,65-261,413901.45
PR SPORT Spółka z ograniczoną odpowiedzialnością ,Dywersyfikacja działalności poprzez uruchomienie działalności w branży fitness,DOLNOŚLĄSKIE,Bolesławiec,Melchiora Wańkowicza,4,59-700,509939.99
FINEZJA TOMASZ KOSIŃSKI ,"Zwiększenie odporności na sytuacje kryzysowe oraz dywersyfikacja przedsiębiorstwa Finezja Tomasz Kosiński zlokalizowanego w Lesznie woj. wielkopolskie, w regionie 5 (obejmującym województwa dolnośląskie, lubuskie i wielkopolskie) poprzez wprowadzenie nowych usług: organizacji imprez okolicznościowych i eventów w terenie, bezpośrednio u klientów oraz cateringu biznesowego oraz dzięki zakupom nowych innowacyjnych środków trwałych w zakresie sprzętu gastronomicznego.",WIELKOPOLSKIE,Leszno,Strzelecka,11,64-100,141458.83
Zbójnicka Chata Renata Witkowska ,"Dywersyfikacja, wdrożenie nowych usług i zwiększenie odporności na kryzys w obiekcie Zbójnicka Chata w województwie dolnośląskim.",DOLNOŚLĄSKIE,Duszniki-Zdrój,Zieleniec,113,57-340,273673.5
Florida Andrzej Drygiel ,"Inwestycja polegająca na uruchomieniu dodatkowej usługi, w postaci sauny oraz wypożyczania rowerów w obiekcie noclegowym Królikówka, prowadzona na terenie regionu piątego, obejmującego województwa wielkopolskie, lubuskie, dolnośląskie",DOLNOŚLĄSKIE,Szczecin,Włodzimierza Ostoi-Zagórskiego,60A,71-810,125846.33
FIRMA HANDLOWO - USŁUGOWA BRONICKA MAGDALENA ,"Unowocześnienie i dywersyfikacja bazy usługowej Hotelu Madelaine przez wdrożenie samoobsługowego domku modułowego ze strefą wellness i spa, promującego zieloną transformację i transformację cyfrową w branży HoReCa, Lwówek Śląski, Dolny Śląsk.",DOLNOŚLĄSKIE,Lwówek Śląski,Henryka Brodatego,2,59-600,412753.46
Eltus sp. z o.o.,Zwiększenia odporności na sytuacje kryzysowe przedsiębiorstwa ELTUS Sp. z o.o. działającego na obszarze województwa dolnośląskiego poprzez unowocześnienie bazy usługowej oraz podniesienie wiedzy i kompetencji pracowników przedsiębiorstwa.,DOLNOŚLĄSKIE,Niemcza,Strzelińska,8,58-230,479507.22
Grzegorz Świrsz WIR-S ,"Inwestycja polegająca na wprowadzeniu nowej usługi organizacji i zarządzania wydarzeniami typu targi, konferencje, eventy, wystawy realizowana na terenie regionu nr 5 w województwie dolnośląskim.",DOLNOŚLĄSKIE,Czernica,Kolejowa,2A,55-003,540000
E-XON S.C. SYLWIA KOTOWICZ," PIOTR IZDEBSKI,Dywersyfikacja działalności E-XON s.c. wprowadzenie do oferty mobilnego studia i uodpornienie na przyszłe kryzysy poprzez rozszerzenie oferty o usługi typu : streamingu, organizacji konferencji online, koncertów , pokazów mody itp.",WIELKOPOLSKIE,Poznań,Romana Maya,1,61-371,510457.76
KIRIBATI CLUB SPÓŁKA Z OGRANICZONĄ ODPOWIEDZIALNOŚCIĄ SPÓŁKA KOMANDYTOWA,"Rozszerzenie i dywersyfikacja działalności biura podróży Kiribati Club poprzez wprowadzenie usługi wynajmu rowerów elektrycznych i kajaków, oraz organizacji wycieczek po Polsce, zlokalizowanego w Regionie 5 w województwie wielkopolskim",WIELKOPOLSKIE,Poznań,Grochowska,59,60-339,508969.7
HB SPÓŁKA Z OGRANICZONĄ ODPOWIEDZIALNOŚCIĄ,Zwiększenie potencjału Hotelu Barczyzna w ramach wsparcia HoReCa dla MŚP z regionu wielkopolskiego.,WIELKOPOLSKIE,Barczyzna,,12,62-330,539811.9
Wanderlust Anna Bejm ,"Konferencje w Karkonoszach - Dywersyfikacja działalności Wanderlust Anna Bejm w kierunku organizacji targów, wystaw, kongresów i eventów w Regionie 5 (woj. dolnośląskim)",DOLNOŚLĄSKIE,Jelenia Góra,,13,58-560,181294
Gastronomia," Handel, Usługi Małgorzata HODOWANA ,Rozwój i dywersyfikacja działalności firmy Gastronomia, Handel, Usługi Małgorzata HODOWANA w województwie dolnośląskim (Region 5).",DOLNOŚLĄSKIE,Siekierczyn,,275,59-818,448184.59
RAAD na Uroczysku Paweł Iwanicki ,Rozwój i dywersyfikacja oferty RAAD na Uroczysku Paweł Iwanicki w województwie śląskim w ramach zwiększania konkurencyjności gospodarki i wspierania mikroprzedsiębiorstw (Region 5- dolnośląskie),DOLNOŚLĄSKIE,Szklarska Poręba,Hugona Kołłątaja,3a,58-580,404218.26
SAGE Ewa Szumlewicz ,Wzmocnienie odporności firmy SAGE Ewa Szumlewicz na nieprzewidywalne zagrożenia zewnętrzne poprzez dywersyfikację oferty produktowej i podniesienie kwalifikacji kadry pracowniczej - Region 5,LUBUSKIE,Łagów,Adama Mickiewicza,21,66-220,451286.64
"TYLIŃSKA MAŁGORZATA FIRMA ""OLIMP"" ","Rozszerzam działalność o ofertę wynajem i dzierżawę sprzętu rekreacyjnego i sportowego PKD 77.21.Z . region 5, (województwo wielkopolskie ). Planujemy zakup 4 nowoczesnych żaglówek . Zakup paneli fotowoltaicznych będzie dostarczać bez emisyjnej energii oraz zakup urządzenia zapewniającego mobilny internet zwiększy komfort , ponadto zakup pętli indukcyjnej dla niepełnosprawnych . Nasza firma bierze udział w specjalistycznych szkoleniach i doradztwie , wspierając rozwój turystyki w regionie.",WIELKOPOLSKIE,Leszno,Węgierska,2,64-100,535727.2
Usługi Turystyczne Gryglówka Wanda Grygiel,Wzmocnienie konkurencyjności oraz odporności na sytuacje kryzysowe przedsiębiorstwa Usługi Turystyczne Gryglówka Wanda Grygiel poprzez dywersyfikację działalności i wprowadzenie nowych usług w Dusznikach-Zdroju w województwie dolnośląskim,DOLNOŚLĄSKIE,Duszniki-Zdrój,Zieleniec,67,57-340,130913.94
ZBIGNIEW NOBIK POL-SERVICE EXPO,"Rozwój i dywersyfikacja firmy POL-SERVICE EXPO Zbigniew Nobik poprzez realizację przedsięwzięcia na terenie regionu obejmującego województwo wielkopolskie, lubuskie i dolnośląskie",WIELKOPOLSKIE,Poznań,Książęca,1,61-361,521891.81
"ADAM PISKOZUB P.P.H.U. ""DAPI""","Uruchomienie nowych usług wraz z unowocześnieniem bazy usługowej przez firmę ADAM PISKOZUB P.P.H.U. ""DAPI"", jako szansa na zdobycie nowych źródeł przychodów (Region 5 - dolnośląskie)",DOLNOŚLĄSKIE,Wrocław,rynek Rynek,36/37,50-102,218837.29
Daria Duda - PODJADEK ,"Adaptacja terenów zielonych dla potrzeb restauracji przy hotelu ""Podjadek"" w województwie wielkopolskim dla wprowadzenia usługi ""Przyjęcia w Harmonii z Naturą"".",WIELKOPOLSKIE,Górzno,,20,63-450,472107.67
RESTAURACJA ZBYSZKO TADEUSZ KOSTYRA ,"Rozszerzenie i zwiększenie odporności działalności restauracji Zbyszko w regionie 5 – województwa dolnośląskie, lubuskie, wielkopolskie",LUBUSKIE,Bogdaniec,Mickiewicza,25,66-450,423259.71
