Nazwa,Nazwa przedsięwzięcia,Miejsce Realizacji Województwo,Grantobiorca Miejscowość,Grantobiorca Ulica,Grantobiorca Nr budynku,Grantobiorca Kod pocztowy,Wartość wsparcia
REGINA Regina Konieczna,"Zwiększenie odporności firmy REGINA Regina Konieczna na sytuacje kryzysowe, poprzez rozszerzenie prowadzonej działalności gospodarczej i rozpoczęcie świadczenia nowej usługi, w województwie lubuskim, Region 5.",LUBUSKIE,Szprotawa,Przejazdowa,6,67-300,539654.4
BOKO GROUP MARTA BORKOWSKA ,Dywersyfikacja działalności BOKO GROUP MARTA BORKOWSKA poprzez wprowadzenie usług turystyki kempingowej i rekreacyjnej oraz skorzystanie ze szkoleń i doradztwa biznesowego w regionie 5 w województwie dolnośląskim,DOLNOŚLĄSKIE,Nowa Ruda,Kościelna,30,57-400,526914
OLMA GASTRONOMIA SPÓŁKA Z OGRANICZONĄ ODPOWIEDZIALNOŚCIĄ,"Dywersyfikacja działalności poprzez rozwój usług wynajmu krótkoterminowego z wykorzystaniem nowoczesnych technologii i zielonych rozwiązań. Region 5 - województwa dolnośląskie, lubuskie, wielkopolskie.",WIELKOPOLSKIE,Luboń,Ludwika Solskiego,19,62-030,540000
„Maikon” Michał Jończyk,"Rozszerzenie profilu dotychczasowej działalności firmy „Maikon” Michał Jończyk poprzez inwestycje mające na celu wdrożenie nowych usług, świadczonych w województwie Dolnośląskim.",DOLNOŚLĄSKIE,Wrocław,Siostrzana,6,53-029,538953.35
ICE BAR POLSKA SP.ZOO,Wzmocnienie odporności oraz potencjału rozwojowego ICE BAR POLSKA SP. Z O.O. poprzez dywersyfikację działalności w obszarze cateringu na terenie województwa wielkopolskiego.,WIELKOPOLSKIE,Poznań,Wrocławska,21,61-838,540000
STREZ SPÓŁKA Z OGRANICZONĄ ODPOWIEDZIALNOŚCIĄ,"Zbudowanie odporności dzięki nowej usługi wypożyczania i dzierżawy sprzętu sportowego przez STREZ Sp. z o.o. z siedzibą we Wrocławiu, region dolnośląski.",DOLNOŚLĄSKIE,Wrocław,Fryderyka Chopina,27,51-609,435741.21
SOLIDBODY MARCIN KASPERSKI,Rozwój regionu Dolnośląskiego poprzez poszerzenie zakresu usług przedsiębiorstwa działającego w branży fitness.,DOLNOŚLĄSKIE,Wrocław,Pocztowa,17,53-313,479940
Diana Codogni Łańcucka,"Rozszerzenie i dywersyfikacja usług firmy Diana Codogni-Łańcucka poprzez wprowadzenie nowych usług związanych z turystyką leśną i organizowanie kursów kulinarnych oraz przystosowanie bieżących usług do nowych realiów rynkowych poprzez zwiększenie ich zasięgu - dotyczy regionu piątego, obejmującego województwa lubuskie, wielkopolskie i dolnośląskie.",DOLNOŚLĄSKIE,Wrocław,rynek Ratusz,16/19,50-101,183744.52
Usługi Cateringowe Agata Nojgebauer,Dywersyfikacja oraz rozszerzenie działalności firmy Usługi Cateringowe i uodpornienie na przyszłe kryzysy poprzez wprowadzenie do oferty nowych usług - Region 5,WIELKOPOLSKIE,Polska Wieś,,3A,62-270,263473.2
EWA BRAMSON-GAWUR G2 STUDIO,ZWIĘKSZENIE ODPORNOŚCI PRZEDSIĘBIORSTWA GAWUR G2 STUDIO POPRZEZ DYWERSYFIKACJĘ PROFILU DZIAŁALNOŚCI I WDROŻENIE NOWEJ USŁUGI,Wielkopolskie,Wyszków,Targowa,36,07-201,539948.7
WMK Krzysztof Hładki,"Wykonanie w ustawionych już 2 kontenerach morskich na potrzeby lokalu gastronomicznego : ocieplenia, instalacji wodnej i elektrycznej, wykończenia części konsumenckiej i kuchennej , zakupu sprzętu gastronomicznego i informatycznego oraz wykonanie tarasu na poziomie zero i widokowego na rzekę Wartę na dachu, wraz z monitoringiem i system zamówień elektronicznych na terenie województwa lubuskiego (Kostrzyn nad Odrą)",LUBUSKIE,Kamień Wielki,Gorzowska,21,66-460,539010
"Maciej Adamczyk PHU ZAJAZD ""ZAPIECEK""","Dywersyfikacja działalności poprzez zakup hali namiotowej przeznaczonej do organizacji wydarzeń - Zajazd Zapiecek, Dąbrowa. Projekt realizowany w regionie 5.",WIELKOPOLSKIE,Marcjanów,,1A,62-704,333443.73
"Albert Bałch Firma Handlowo-Usługowa ""ELEKTRYK""","Rozwój i dywersyfikacja usług przedsiębiorstwa w zakresie działalności ""Ranczo Targówka"" poprzez wprowadzenie do oferty usług organizacji konferencji, szkoleń i spotkań biznesowych z możliwością wypoczynku i relaksu w strefie SPA oraz wykorzystaniem innych elementów rekreacji, w celu wzmocnienia odporności firmy na potencjalne kryzysy gospodarcze.",WIELKOPOLSKIE,Dębe,,26,62-817,439161.24
KOCIOŁEK LUBUSKI Urszula Gozdek,"Rozszerzenie działalności przedsiębiorstwa poprzez stworzenie nowego plenerowego punktu gastronomicznego typu food court pod nazwą ""Parkside Delights"" w Słubicach, w województwie lubuskim, oferującym: włoskie lody, pizzę z pieca, zimne napoje typu slush, dania z grilla oraz kawę",LUBUSKIE,Słubice,Sportowa,1a,69-100,419653.01
RESTAURACJA IMPULS Marzena Swora,Dywersyfikacja działalności RESTAURACJA IMPULS Marzena Swora i uodpornienie na przyszłe kryzysy poprzez wprowadzenie do oferty nowych usług - imprezy plenerowe- REGION 5,WIELKOPOLSKIE,Zduny,Łacnowa,13,63-760,530276.88
IMA Alexander Militskih,Nowe kierunki rozwoju i dywersyfikacji usług Restauracji u Myśliwych w Poznaniu w województwie wielkopolskim w ramach zwiększania konkurencyjności gospodarki i wspierania przedsiębiorstw (Region 5),WIELKOPOLSKIE,Poznań,Karola Libelta,37,61-707,421355.29
"Zajazd ""OSTĘP"" Jolanta Otocka","ZWIĘKSZENIE ODPORNOŚCI PRZEDSIĘBIORSTWA ZAJAZD ""OSTĘP"" POPRZEZ DYWERSYFIKACJĘ PROFILU DZIAŁALNOŚCI I WDROŻENIE NOWEJ USŁUGI",WIELKOPOLSKIE,Gorzyń,,35,64-400,524520
MONIKA GALOS DWOREK GALOSA,"Zwiększenie odporności przedsiębiorstwa MONIKA GALOS DWOREK GALOSA na przyszłe sytuacje kryzysowe poprzez rozszerzenie oferowanych usług o organizację zajęć rekreacyjnych na ściance wspinaczkowej. Region 5, województwo dolnośląskie,",DOLNOŚLĄSKIE,Strachocin,,8,57-550,538212.21
GRAFFITI Paweł Lewandowski,Dywersyfikacja działalności firmy GRAFFITI Paweł Lewandowski i uodpornienie na przyszłe kryzysy poprzez wprowadzenie do oferty usług SPA i wypożyczalni rowerów - Region 5,WIELKOPOLSKIE,Leszno,dr. Bronisława Świderskiego,11,64-100,96275.7
PIXEL MULTIMEDIA SPÓŁKA Z OGRANICZONĄ ODPOWIEDZIALNOŚCIĄ,Dywersyfikacja działalności PIXEL Multimedia (Region 5 - Wielkopolska) celem uodpornienia firmy przed pandemią COVID-19 i kryzysami.,WIELKOPOLSKIE,Poznań,Pogodna,30,60-275,534600
GÓRKA & KULKA S.C. MAGDALENA KOWALSKA," PAWEŁ GÓRKA,Inwestycja w dywersyfikację działalności GÓRKA & KULKA S.C. MAGDALENA KOWALSKA, PAWEŁ GÓRKA w regionie Lubuskim.",LUBUSKIE,Gorzów Wielkopolski,gen. Władysława Sikorskiego,126,66-400,521190
GASTRO MUSIC Radosław Witkowski,Dywersyfikacja działalności poprzez uruchomienie nowych usług w firme GASTRO MUSIC Radosław Witkowski w celu zwiększenia odporności i konkurencyjności firmy.,WIELKOPOLSKIE,Janowice,Szafirowa,36,62-571,535322.91
AVESPHARM Aleksandra Dobrzyńska,"Zabezpieczenie działalności firmy Avespharm Aleksandra Dobrzyńska przed sytuacjami kryzysowymi poprzez wdrożenie nowych usług gastronomicznych – projekt realizowany w regionie nr 5 dla województw: dolnośląskiego, lubuskiego i wielkopolskiego.",WIELKOPOLSKIE,Nowy Tomyśl,Poznańska,19,64-300,400683.4
Biuro Rezerwacji Karpacz Agnieszka Mieszkalska ,Rozszerzenie działalności firmy o usługi krótkoterminowego zakwaterowania w przyczepach kempingowych na terenie regionu 5,Dolnośląskie,Karpacz,Adama Mickiewicza,7,58-540,509400
Marek Markowski,Rozwój zaplecza turystycznego w regionie Dolnośląskim poprzez zakup nowych środków trwałychv,DOLNOŚLĄSKIE,Wrocław,Księcia Witolda,49,50-202,479940
CGS SPÓŁKA Z OGRANICZONĄ ODPOWIEDZIALNOŚCIĄ,Wzmocnienie odporności i konkurencyjności przedsiębiorstwa CGS Sp. z o.o. poprzez poszerzenie zakresu oferty oraz podniesienie jakości usług restauracyjnych - województwo lubuskie,LUBUSKIE,Zielona Góra,Bohaterów Westerplatte,8,65-034,501668.95
INTAK DARIUSZ GRAY,Przygotowanie działalności gospodarczej Wnioskodawcy prowadzonej w branży HoReCa do wprowadzenia nowej usługi polegającej na prowadzeniu restauracji w ośrodku wypoczynkowym zlokalizowanym w miejscowości Karpicko nad Jeziorem Wolsztyńskim w województwie wielkopolskim.,WIELKOPOLSKIE,Karpicko,Wczasowa,87,64-200,331650
KB FOOD&CATERING SPÓŁKA Z OGRANICZONĄ ODPOWIEDZIALNOŚCIĄ,"Dywersyfikacja oferty usługowej w Regionie nr 5 obejmującym rynek wrocławski, poprzez rozszerzenie działalności przedsiębiorstwa gastronomicznego o nowy zakres usług dla klienta biznesowego w obecności nowej kuchni francuskiej i międzynarodowej przy zaangażowaniu wydatków inwestycyjnych, usług szkoleniowych i doradczych oraz transformacji cyfrowej, z poszanowaniem Polityk Horyzontalnych, w celu zwiększenia konkurencyjności i odporności na kolejne kryzysy typu COVID-19.",DOLNOŚLĄSKIE,Wrocław,Podwale,83,50-414,479940.13
TIMES EVENT CENTER Dariusz Senkowski,"Dywersyfikacja oferty usługowej w Regionie nr 5 obejmującym rynek wrocławski, poprzez rozwój działalności w sektorze HoReCa i turystyki poprzez wprowadzenie nowych usług w celu zwiększenia konkurencyjności i odporności na kolejne kryzysy typu COVID-19.",DOLNOŚLĄSKIE,Stanowice,,90,55-200,500459.4
SALA U SIUDAKA Rafał Siudak,"Opracowanie i wdrożenie przez firmę Sala u Siudaka Rafał Siudak nowej usługi: ""Siudak Festiwal"" - organizacja imprez, konferencji i spotkań plenerowych. Rozszerzenie i dywersyfikacja dotychczasowej działalności firmy. Region 5 woj. lubuskie",LUBUSKIE,Sulęcin,Jana Paska,1A,69-200,271320
Jacek Jurkowski-Maślak STARY FOLWARK,Rozszerzenie działalności firmy Jacek Jurkowski-Maślak Stary Folwark poprzez stworzenie Strefy SPA i uruchomienie wypożyczalni sprzętu sportowego w ramach zwiększania odporności podmiotów branży HoReCa w województwie lubuskim (region 5),LUBUSKIE,Żary,Śródmiejska,13,68-200,472945.65
"HUBERT KRAWIEC ""LOGO HOME""","Dywersyfikacja i rozszerzenie działalności przedsiębiorstwa Hubert Krawiec ""LOGO HOME"" poprzez świadczenie nowych, stacjonarnych usług sportowo-rekreacyjnych i restauracyjnych w Bytomiu Odrzańskim (Region 5, województwo lubuskie, powiat nowosolski).",LUBUSKIE,Zielona Góra,Przylep-Zakładowa,5,66-015,537651
JOLANTA TROSKA RELAX,"Relax Events - rozszerzenie działalności o nową usługę: organizację eventów, konferencji i wydarzeń w nowoczesnej sezonowej hali namiotowej. Region 5 - woj. wielkopolskie",WIELKOPOLSKIE,Słupia pod Bralinem,,83b,63-642,504000
Zajazd CHROBRY Waldemar Dubik,"Rozszerzenie profilu dotychczasowej działalności usług w przedsiębiorstwie ,, Zajazd Chrobry” Waldemar Dubik, poprzez inwestycję w nową salę konferencyjną mającą na celu wdrożenie nowej usługi, świadczonej w województwie lubuskim",LUBUSKIE,Torzym,Warszawska,19,66-235,538837.73
Walizka Wspomnień Marcin Palacz,"Inwestycja firmy ""Walizka Wspomnień"" Marcin Palacz we wzmocnienie odporności przedsiębiorstwa poprzez zieloną transformację, transformację cyfrową i rozszerzenie oferty noclegowej o dodatkowe atrakcje, a tym samym umocnienie pozycji rynkowej przedsiębiorstwa w regionie dolnośląskim.",DOLNOŚLĄSKIE,Karpacz,Dolna,4b,58-540,288557.72
Mad Music Agency Adam Barczak,"Rozszerzenie profilu dotychczasowej działalności usług w przedsiębiorstwie Mad Music Agency Adam Barczak , poprzez wdrożenie nowej usługi, świadczonej w województwie wielkopolskim",WIELKOPOLSKIE,Uciechów,Długa,61,63-430,531061.48
ZBÓJNICKA GROTA USŁUGI GASTRONOMICZNE BEATA ROGOWSKA,Inwestycja na terenie województwa lubuskiego w zwiększenie odporności przedsiębiorstwa oraz rozszerzenie działalności gospodarczej o nową usługę cateringu w Restauracji ZBÓJNICKA GROTA poprzez inwestycje w nowoczesne urządzenia i wyposażenie gastronomiczne oraz prace remontowe i nowoczesne oprogramowanie do zarządzania zamówieniami celem wprowadzenia na rynek nowej oferty i pozyskania nowych klientów.,LUBUSKIE,Zielona Góra,Fryderyka Chopina,9,65-031,313643.28
KAMA PARK PIOTR KAJA," PIOTR MARUT SPÓŁKA JAWNA,Dywersyfikacja dotychczasowej działalności KAMA PARK PIOTR KAJA, PIOTR MARUT SPÓŁKA JAWNA o usługi cateringowe oraz wypożyczalnię rowerów elektrycznych dla Mieszkańców Sierakowa oraz woj. Wielkopolskiego ( REGION 5).",WIELKOPOLSKIE,Sieraków,Orla,13,64-410,539277.3
ECLIPSE ENTERPRISE SPÓŁKA Z OGRANICZONĄ ODPOWIEDZIALNOŚCIĄ,Rozwój turystyki Dolnego Śląska poprzez wsparcie przedsiębiorstwa ECLIPSE ENTERPRISE SP. Z O.O.,DOLNOŚLĄSKIE,Kobierzyce,Kwiatowa,75,55-040,276115.92
LOPEZ SPÓŁKA Z OGRANICZONĄ ODPOWIEDZIALNOŚCIĄ,Zwiększenie konkurencyjności i odporności przedsiębiorstwa LOPEZ Sp. z o.o. poprzez inwestycję w dywersyfikację działalności prowadzonej w Poznaniu (woj. wielkopolskie).,WIELKOPOLSKIE,Poznań,Bolesława Krysiewicza,3,61-825,487952.59
TM SPÓŁKA Z OGRANICZONĄ ODPOWIEDZIALNOŚCIĄ,"Wprowadzenie nowej usługi „Wypożyczanie i dzierżawa sprzętu rekreacyjnego i sportowego” w ramach dywersyfikacji obecnej działalności firmy TM Sp. z o.o. oraz podniesienie kompetencji pracowników i udoskonalenie obecnego modelu biznesowego firmy celem zwiększenia liczby klientów, wzrostu konkurencyjności i odporności firmy na sezonowość i ewentualne przyszłe kryzysy gospodarcze.",LUBUSKIE,Zielona Góra,Aleja Niepodległości,10,65-001,235142.07
PHU Omega Aurelia Imańska,"Pozyskanie dofinansowania na zwiększenie konkurencyjności i odporności przedsiębiorstwa na kryzysy poprzez wprowadzenie na rynek krajowy nowego produktu Bubble Waffle, prowadzone na terenie regionu 5 obejmującego województwa: wielkopolskie, lubuskie, dolnośląskie w ramach inwestycji A1.2.1 KPO",LUBUSKIE,Motylewo,,7a,66-450,285743.59
Kamil Stanek BE ACTIVE,Nowe usługi Kamil Stanek BE ACTIVE,LUBUSKIE,Nowa Sól,Skłodowskiej-Curie,15,67-100,508254.44
LAREDO MAKSYMILIAN KARKOWSKI,Dywersyfikacja działalności przedsiębiorstwa LAREDO MAKSYMILIAN KARKOWSKI szansą na rozwój i odbudowę branży w regionie 5,WIELKOPOLSKIE,Józefów,,52A,62-800,332086.73
MARCIN KUŚMIREK,Nowy wymiar turystyki – Planowanie eventów turystycznych oraz przewodnictwo z wykorzystaniem innowacyjnych i ekologicznych technologii – woj. wielkopolskie,WIELKOPOLSKIE,Konin,Berylowa,3,62-500,104119.44
HEKTOR Mateusz Rudyk,Nowe usługi HEKTOR,LUBUSKIE,Rybno,,8,65-943,377834.8
Muchos Patatos sp. z o.o.,"INWESTYCJA REALIZOWANA NA TERENIE REGIONU 5 OBEJMUJĄCEGO WOJEWÓDZTWA DOLNOŚLĄSKIE, LUBUSKIE I WIELKOPOLSKIE, POLEGAJĄCA NA ROZSZERZENIU DZIAŁALNOŚCI RESTAURACJI „DWOREK KARŁÓW"" O KOMPLEKSOWE USŁUGI KATERINGOWE DLA ODBIORCÓW INSTYTUCJONALNYCH, GRUPOWYCH I INDYWIDUALNYCH, Z ROZBUDOWĄ SPRZĘTOWEGO ZAPLECZA PRODUKCYJNEGO, WYDAWCZEGO I TRANSPORTOWEGO Z UŻYCIEM ELEKTRO-MOBILNOŚCI, MAJĄCA NA CELU DYWERSYFIKACJĘ DZIAŁALNOŚCI PRZEDSIĘBIORSTWA I OGRANICZENIE SKUTKÓW WPŁYWU COVID 19 NA PRZEDSIĘBIORSTWO.",DOLNOŚLĄSKIE,Poznań,Feliksa Nowowiejskiego,13,61-732,146222.32
KBR TOMASZ KLEDZIK,Dywersyfikacja działalności firmy KBR Tomasz Kledzik z województwa wielkopolskiego celem pozyskania nowych klientów oraz zwiększenia odporności na pojawiające się sytuacje kryzysowe,WIELKOPOLSKIE,Poznań,Szamotulska,83,62-081,412607.9
STARA SZKOŁA-UŚCIE Katarzyna Greszczuk,"Dywersyfikacja i rozszerzenie działalności firmy Stara Szkoła Uście Katarzyna Greszczuk oraz uodpornienie na przyszłe kryzysy poprzez wprowadzenie nowych usług oraz stworzenie przestrzeni dla nowych klientów - na terenie regionu nr 5, woj. lubuskiego.",LUBUSKIE,Uście,,18,67-415,311148
RUNFOREST SAWICKI KARATAJ SPÓŁKA JAWNA,"Rozszerzenie i dywersyfikacja działalności Runforest działającej w województwie lubuskim, w Regionie 5",LUBUSKIE,Niedźwiedź,,7,66-220,346759.75
ZŁOTA WODA GRACJAN RUDNICKI,"Rozszerzenie i dywersyfikacja działalności firmy Złota Woda Gracjan Rudnicki poprzez uruchomienie usług hotelowych z systemem cyfrowych zamków, nowoczesnym wyposażeniem i rozwiązaniami ekologicznymi, promujących zieloną transformację i transformację cyfrową w branży HoReCa, Łomnica, Dolny Śląsk.",DOLNOŚLĄSKIE,Łomnica,Sudecka,Działka104,58-340,404806.28
Gajowa 12 Konrad Lupa,"Dywersyfikacja prowadzonej działalności poprzez wprowadzenie nowych usług i produktów opartych na kuchni włoskiej i słodkich wypiekach w oparciu o kod PKD 56.10B, 56.21.Z i 56.30.Z w regionie 5 w województwie wielkopolskim.",WIELKOPOLSKIE,Suchy Las,Szkolna,16,62-002,539960.5
Zacisze spółka jawna Arkadiusz Janczewski," Agnieszka Urszula Wnuk,Wprowadzenie nowych usług oraz cyfryzacja sposobu prowadzenia hotelu Zacisze sposobem na podniesienie odporności na sytuacje kryzysowe oraz podniesienie jakości usług turystycznych w woj. wielkopolskim.",WIELKOPOLSKIE,Złotów,,4,77-400,414000
Folwark Pszczew Łukasz Robak,"Przygotowanie działalności gospodarczej Wnioskodawcy prowadzonej w branży HoReCa do wprowadzenia nowej usługi związanej z poprawą kondycji fizycznej polegającej na prowadzeniu salonu masażu odchudzającego i relaksacyjnego oraz sauny, mającej na celu poprawę samopoczucia, oferowanej w budynku na terenie Folwarku Pszczew w województwie lubuskim.",LUBUSKIE,Pszczew,Stefana Batorego,11,66-330,539370
JĘDRZEJ POPIELARZ FLOW EVENTS,Flow Movies - Mobilne kino plenerowe z innowacyjnym systemem rezerwacji biletów online: Rozwój i dywersyfikacja usług kulturalnych w woj. wielkopolskim,WIELKOPOLSKIE,Poznań,Brzask,10,60-369,160998.77
"RESTAURACJA ""KAMIENICA SMAKU "" OLIWIA SZCZEBIOT","Działania inwestycyjne celem zwiększenia odporności przedsiębiorstwa na przyszłe kryzysy polegające na rozszerzeniu działalności gospodarczej o nowe usługi w firmie RESTAURACJA ""KAMIENICA SMAKU "" OLIWIA SZCZEBIOT poprzez wprowadzenie nowej usługi cateringu dietetycznego pudełkowego dla firm w oparciu o zawartą z nimi umowę przez określony czas, a także wdrożenie nowej usługi organizacji szkoleń w lokalu firmy w województwie lubuskim.",LUBUSKIE,Gorzów Wielkopolski,Obotrycka,5,66-400,311218.92
ZBIGNIEW RUTKOWSKI CZERWONA BUDKA,Modernizacja i rozszerzenie działalności gastronomicznej Czerwona Budka przez wdrożenie nowoczesnych rozwiązań technologicznych i ekspansję usług cateringowych W REGIONIE 5 LUBUSKIE,LUBUSKIE,Zielona Góra,Krępa-Podgórna,1B,66-001,200712.56
"Firma Usługowo- Handlowa ""AJT"" Andrzej Tomczak","Nowe produkty i usługi w Firmie Handlowo- Usługowej ""AJT"" Andrzej Tomczak",LUBUSKIE,Międzyrzecz,Hugo Kołłątaja,4,66-300,509026.42
Wypas po pas DOMINIKA GORZYŃSKA,"Dywersyfikacja, zwiększenie odporności na sytuacje kryzysowe i wprowadzenie nowej usługi w firmie Wypas po pas DOMINIKA GORZYŃSKA w województwie Wielkopolskim - Region 5",WIELKOPOLSKIE,Jarosławki,,1z,63-130,523314.04
MAK Łasuch KRZYSZTOF GORZYŃSKI,"Dywersyfikacja, zwiększenie odporności na sytuacje kryzysowe i wprowadzenie nowej usługi w firmie MAK Łasuch KRZYSZTOF GORZYŃSKI województwie Wielkopolskim - Region 5",WIELKOPOLSKIE,Jarosławki,,1,63-130,527856.13
Tomasz Stefanowicz Real Estate,"Dywersyfikacja przedsiębiorstwa o otworzenie wypożyczalni rowerów i hulajnóg, rozpoczęcie usług organizacji wycieczek turystycznych po mieście Zielona Góra oraz podniesienie standardu posiadanych już obiektów noclegowych (województwo Lubuskie)",LUBUSKIE,Zielona Góra,Drzewna,20,65-060,346995.06
"USŁUGI GASTRONOMICZNE ""DELICJUSZ"" JAKUB WAJSBERG","Inwestycja polegająca na dywersyfikacji działalności firmy DELICJUSZ w Sulechowie poprzez powstanie nowego punktu gastronomicznego - tawerny greckiej i rozwój usług cateringowych, prowadzona na terenie regionu 5",LUBUSKIE,Sulechów,Morelowa,37,66-100,422148.6
Nowy folwark Na Skraju Lasu Iga Szychowska,"Dywersyfikacja działalności o prowadzenie sali dydaktyczno-ruchowej, służącej poprawie zdolności fizycznych oraz sensorycznych dzieci i młodzieży, poprzez nabycie i wdrożenie niezbędnego dla organizacji kursów i zajęć sportowych i rekreacyjnych wyposażenia, w przedsiębiorstwie ""Nowy folwark na skraju lasu"" Iga Szychowska w regionie 5",WIELKOPOLSKIE,Nowy Folwark,Mostowa,1,62-300,540000
Studio Majorka Wojciech Antoszków,"Rozszerzenie usług przedsiębiorstwa Studio Majorka - Wojciech Antoszków poprzez wprowadzenie nowoczesnej technologii oraz transformację cyfrową i zieloną w Regionie 5, województwo: Lubuskie",LUBUSKIE,Nowa Sól,Aleksandra Fredry,dz. 179/80,67-100,158435.97
PEKAPE Małgorzata Graefe,"Poszerzenie oferty turystycznej działalności w celu zwiększenia odporności i konkurencyjności na rynku, działanie w województwie lubuskim, w miejscowościOśno Lubuskie",LUBUSKIE,Ośno Lubuskie,Konwaliowa,5,69-220,503853
EVENTOWO JOANNA WIERSZYŁŁOWSKA-DUDEK,"Unowocześnienie bazy usługowej oraz rozszerzenie oferty firmy poprzez wprowadzenie wypożyczalni rowerów wraz z osprzętem, a także sprzętu rekreacyjnego z możliwością organizacji animacji na życzenie klienta, co ma na celu zwiększenie atrakcyjności usług dla klientów z różnych grup wiekowych i zainteresowań oraz podniesienie konkurencyjności na rynku. Projekt będzie realizowany w Regionie 5 (Dolnośląskie, Lubuskie, Wielkopolskie).",WIELKOPOLSKIE,Poznań,Kotowo,60E,60-009,440613.15
CENTRUM TAŃCA DANCE.PL ZBIGNIEW ZASADA,Kompleksowa Organizacja Wydarzeń Online i Hybrydowych w Regionie Dolnośląskim,DOLNOŚLĄSKIE,Wrocław,Lucjana Siemieńskiego,17,50-228,504578.42
AVANGARDA ŁUKASZ KONIK,Wprowadzenie nowych usług w regionie lubuskim szasną skutecznego odbudowania lokalnego potencjału MŚP,LUBUSKIE,Gorzów Wielkopolski,,12,66-400,479940
KAVA BAR MANHATTAN ANNA MACZICHIN,Rozszerzenie oferty KAVA BAR MANHATTAN ANNA MACZICHIN wraz z dywersyfikacją świadczonej oferty o nowy punkt gastronomiczny - Region 5 - woj. lubuskie.,LUBUSKIE,Łęknica,Graniczna,c120,68-208,539947.62
ROMA - GARBACIAK KRZYSZTOF,"Dywersyfikacja, wdrożenie nowych usług/produktów i zwiększenie odporności na kryzys w Restauracji Roma w Poznaniu (Region 5 - woj. wielkopolskie)",WIELKOPOLSKIE,Pyzdry,Niepodległości,69,62-310,351989.58
"ZBIGNIEW HOCHÓŁ - FIRMA HANDLOWO-USŁUGOWA ""AGAT""",Poszerzenie usług i wdrożenie działań wzmacniających przedsiębiorcę sektora MŚP szansą rozwoju regionu dolnośląskiego.,DOLNOŚLĄSKIE,Szklarska Poręba,1 Maja,19,58-580,479940
"RANCHO""COLORADO"" Agaciak Anna","ZWIĘKSZENIE ODPORNOŚCI PRZEDSIĘBIORSTWA RANCHO ""COLORADO"" POPRZEZ DYWERSYFIKACJĘ PROFILU DZIAŁALNOŚCI I WDROŻENIE NOWEJ USŁUGI",WIELKOPOLSKIE,Trzciel-Odbudowa,,14A,64-361,536166
KPOD.01.03-IW.01-B881/24,Rozszerzenie i dywersyfikacja działalności GOSPODARSTWA AGROTURYSTYCZNEGO MACIEJ HEINA zlokalizowanego w Regionie 5 w województwie wielkopolskim,WIELKOPOLSKIE,Dębogóra,,18,64-730,530842.6
TROPICANA Sp. z o.o,"Rozszerzenie profilu działalności w przedsiębiorstwie Tropicana sp. z o.o. mające na celu wdrożenie nowych usług i dywersyfikację działalności, świadczonej w województwie lubuskim",LUBUSKIE,Zielona Góra,Kazimierza Wielkiego,7,65-047,539674.81
ADB SPÓŁKA Z OGRANICZONĄ ODPOWIEDZIALNOŚCIĄ,"Rozszerzenie profilu dotychczasowej działalności w przedsiębiorstwie ADB sp. z o.o. mające na celu wdrożenie nowej usługi, świadczonej w województwie lubuskim",LUBUSKIE,Zielona Góra,Kazimierza Wielkiego,7,65-047,539742.14
BNL24 SPÓŁKA Z OGRANICZONĄ ODPOWIEDZIALNOŚCIĄ,"Rozszerzenie profilu działalności w przedsiębiorstwie BNL24 sp. z o.o. mające na celu wdrożenie nowych usług i dywersyfikację działalności, świadczonej w województwie lubuskim",LUBUSKIE,Zielona Góra,Kazimierza Wielkiego,7,65-047,539593.84
Board Akademia Joanna Chojcan,Zwiększenie odporności przedsiębiorstwa Board Akademia Joanna Chojcan na sytuacje kryzysowe poprzez rozszerzenie oraz dywersyfikację działalności prowadzonej w Województwie Dolnośląskim Region 5,DOLNOŚLĄSKIE,Tyniec Mały,Jesionowa,12,55-040,349662.34
LA CONCORDE SŁAWOMIR SARNICKI,"Rozszerzenie działalności firmy ""LA CONCORDE"" SŁAWOMIR SARNICKI o działalność gastronomiczną.",LUBUSKIE,Zielona Góra,Kazimierza Wielkiego,21,65-001,309146.9
LEŚNICZÓWKA PRZYŁĘSKO SPÓŁKA Z OGRANICZONĄ ODPOWIEDZIALNOŚCIĄ,"Dywersyfikacja działalności Leśniczówki Przyłęsko w województwie lubuskim poprzez utworzenie Centrum Wellness i SPA w regionie 5, obejmującym województwa lubuskie, dolnośląskie i wielkopolskie.",LUBUSKIE,Gorzów Wielkopolski,Owcza,22,66-400,471714.03
POLISH WORK CENTER PLUS Sp. z o.o.,Rozszerzenie działalności firmy poprzez wprowadzenie ekologicznej usługi wynajmu łodzi elektrycznych. - woj. wielkopolskie,WIELKOPOLSKIE,Puszczykowo,Poznańska,54,62-040,414000
Projekt Natura Agnieszka Rybarczyk,Dywersyfikacja działalności przedsiębiorcy działającego pod firmą Projekt Natura Agnieszka Rybarczyk poprzez wprowadzenie usług wynajmu sprzętu wodnego oraz kina letniego w ramach zwiększania odporności podmiotów branży HoReCa w województwie wielkopolskim (region 5),WIELKOPOLSKIE,Poznań,Kamiennogórska,7,61-179,427002.1
"PRZEDSIĘBIORSTWO WIELOBRANŻOWE ""RAWIOLI"" RESTAURACJA LEW JOLANTA TOMALAK",Wzmocnienie Przedsiębiorstwa poprzez uruchomienie nowych usług w restauracji Biały Lew,LUBUSKIE,Żary,Osadników Wojskowych,52,68-200,404863.44
STARGAST SPÓŁKA Z OGRANICZONĄ ODPOWIEDZIALNOŚCIĄ,"Rozwój i dywersyfikacja firmy Stargast sp. z o.o. na terenie regionu nr 5, woj. dolnośląskiego.",DOLNOŚLĄSKIE,Wrocław,Szewska,59,50-139,505999.5
AGROMAX Makysmilian Jaśkiewicz,Zdrowie i Regeneracja w Tamarynowej Osadzie,WIELKOPOLSKIE,Łowyń,,4,64-426,513546.3
Restauracja VEGA Spółka z ograniczoną odpowiedzialnością,"Otwarcie restauracji i kawiarni ""Mleczarnia"" z obsługą codzienną we własnym lokalu gastronomicznym w Dobrej na ul. Dekerta 18, w ramach Inwestycji A1.2.1 KPO z regionu nr 5. Restauracja z ofertą fast-food oraz kawiarnią typu bistro, ukierunkowaną na obsługę stałych klientów lokalnych w każdym wieku oraz turystów, z dodatkową propozycją ekologicznych usług transportowych.",Wielkopolskie,Dobra,Jana Dekerta,18,62-700,484428
