Nazwa,Nazwa przedsięwzięcia,Miejsce Realizacji Województwo,Grantobiorca Miejscowość,Grantobiorca Ulica,Grantobiorca Nr budynku,Grantobiorca Kod pocztowy,Wartość wsparcia
Iwona Lewalska LeVilla,Rozszerzenie działalności o usługę FamilyPicnicZone - Polska Fundacja Przedsiębiorczości - pomorskie,POMORSKIE,Rewa,Surfingowa,9,81-198,107862.45
"PRZEDSIĘBIORSTWO WIELOBRANŻOWE ""PROFIT"" KRYSTYNA KLINKOSZ","Rozszerzenie działalności P.W. ""PROFIT"" poprzez realizację inwestycji w branży HORECA w Łebie w województwie pomorskim",POMORSKIE,Łeba,Szkolna,1A,84-360,297465.3
Metropolis spółka z ograniczoną odpowiedzialnością,"Śniadaniowa rewolucja w restauracji ""Stare Metropolis"" - nowe smaki na toruńskiej mapie kulinarnej (Region 1 - kujawsko-pomorskie)",KUJAWSKO-POMORSKIE,Toruń,Podmurna,28,87-100,492539.4
PHU CRISTAL JAKUB KLOREK,"Rozszerzenie i dywersyfikacja działalności firmy PHU CRISTAL JAKUB KLOREK poprzez uruchomienie usług cateringowych, eventów w plenerze i wdrożenie systemu zamówień online w Regionie 1 uodparniających firmę na sytuacje kryzysowe tj. COVID-19",KUJAWSKO-POMORSKIE,Ostromecko,Bydgoska,8,86-070,524795.14
In-Puls Michał Gołębiecki,Wzmocnienie odporności oraz potencjału rozwojowego Firmy In-Puls poprzez dywersyfikację działalności w obszarze utworzenia wypożyczali jachtów żaglowych na terenie województwa zachodniopomorskiego,ZACHODNIOPOMORSKIE,Mierzyn,Nad Stobnicą,18a,72-006,540000
Z. & K. ŁATA S.C.,Zwiększenie odporności przedsiębiorstwa na sytuacje kryzysowe poprzez stworzenie oferty dla rodzin z dziećmi z udogodnieniami dla osób niedowidzących i niewidomych w tym: sworzenie 3 nowych apartamentów oraz wprowadzenie nowej usługi w formie sauny zewnętrznej skierowanej dla gości obiektu oraz dla klientów z zewnątrz.,ZACHODNIOPOMORSKIE,Trzebiatów,Lipowa,16,72-320,539803.85
P.H.U.HOŁOGA ANDRZEJ HOŁOGA,Dywersyfikacja działalności P.H.U.HOŁOGA ANDRZEJ HOŁOGA z kujawsko-pomorskiego poprzez wdrożenie usługi wynajmu łodzi elektrycznych,KUJAWSKO-POMORSKIE,Osówiec,Poziomkowa,2,86-014,527952.6
„ALBAX” Spółka z ograniczoną odpowiedzialnością,Dywersyfikacja w zakresie działalności gastronomicznej i hotelarskiej w Kielczance w Kołobrzegu w województwie zachodniopomorskim,ZACHODNIOPOMORSKIE,Kołobrzeg,Marii Rodziewiczówny,15,78-100,413235.24
HNC Henryk Nowak,Rozszerzenie działalności przedsiębiorstwa HNC Henryk Nowak z zachodniopomorskiego o pakiety wypoczynkowe z atrakcjami prozdrowowtnymi w miejscowości Gąski,ZACHODNIOPOMORSKIE,Wałcz,os. Osiedle Piastowskie,15,78-600,538624.8
MACH PIOTR VON MACH,Dywersyfikacja działalności Mach Piotr Von Mach poprzez inwestycje w woj. Pomorskim.,POMORSKIE,Banino,Lipowa,19,80-297,200700
EVENTS IN POLAND SPÓŁKA Z OGRANICZONĄ ODPOWIEDZIALNOŚCIĄ,Dywersyfikacja oferty firmy o usługi noclegowe świadczone w województwie kujawsko- pomorskim (region nr 1),KUJAWSKO-POMORSKIE,Bydgoszcz,Marii Curie Skłodowskiej,10,85-094,393380
Baza Turystyczna “Ranczo” Danuta Nowak,Rozszerzenie oferty firmy Baza Turystyczna “Ranczo” Danuta Nowak z zachodniopomorskiego o nową usługę wynajmu pokoi całorocznych z wyżywieniem i innymi udogodnieniami na miejscu w obiekcie,ZACHODNIOPOMORSKIE,Strączno,,1W,78-642,532626.3
ALMAX ANNA MAŁOLEPSZA-PIĘCIAK,Inwestycja na terenie województwa zachodniopomorskiego (w Regionie 1) w zwiększenie odporności przedsiębiorstwa oraz rozszerzenie działalności gospodarczej o nowe usługi w Panorama Park prowadzonym przez ALMAX ANNA MAŁOLEPSZA-PIĘCIAK w Świnoujściu,ZACHODNIOPOMORSKIE,Świnoujście,Henryka Sienkiewicza,15,72-600,424611.55
FIRMA 1812 ARTUR MOSTOWY,Rozszerzenie i dywersyfikacja działalności przedsiębiorstwa Firma 1812 Artur Mostowy w województwie pomorskim polegające na uruchomieniu zewnętrznego SPA z rodzinną strefą wypoczynkową.,POMORSKIE,Orzech,Bytomska,27e,42-622,539199.88
USŁUGI HOTELARSKO-GASTRONOMICZNE PAWEŁ BYLICKI,"Inwestycja w województwie zachodniopomorskim w zwiększenie odporności przedsiębiorstwa oraz dywersyfikację usług w firmie Usługi Hotelarsko-Gastronomiczne Paweł Bylicki poprzez uruchomienie bistra z kinem, strefy rozrywki i wypożyczalni rowerów elektrycznych celem pozyskania nowych klientów.",ZACHODNIOPOMORSKIE,Pogorzelica,Słoneczna,2,72-351,460591.89
KARTUSKA AGENCJA REKLAMOWA BOŻENA WEROCHOWSKA,Zwiększenie odporności przedsiębiorstwa KARTUSKA AGENCJA REKLAMOWA BOŻENA WEROCHOWSKA na sytuacje kryzysowe w wyniku dywersyfikacji prowadzonej działalności (REGION 1: województwo pomorskie,POMORSKIE,Dzierżążno,Kartuska,17,83-332,473441.8
PEKARNIK Marcin Marciński,Dywersyfikacja i rozszerzenie działalności firmy PEKARNIK Marcin Marciński (województwo pomorskie) w kierunku nowych usług gastronomicznych oraz cateringowych wraz ze zwiększeniem odporności firmy na przyszłe kryzysy i zmniejszeniem wpływu przedsiębiorstwa na klimat i środowisko.,POMORSKIE,Reda,Ks. Józefa Poniatowskiego,21,84-240,214588.49
ALKA SUN RESORT SPÓŁKA Z OGRANICZONĄ ODPOWIEDZIALNOŚCIĄ,"Wzmocnienie przedsiębiorstwa Alka Sun Resort Spółka z o.o. poprzez dywersyfikację, nowe produkty/usługi. Projekt realizowany w regionie zachodniopomorskim.",ZACHODNIOPOMORSKIE,Ustronie Morskie,Wojska Polskiego,7,78-111,207786.91
KRAJAN SPÓŁKA Z OGRANICZONĄ ODPOWIEDZIALNOŚCIĄ,"Zakup jachtu motorowego w celu wprowadzenia i rozszerzenia działalności Firmy KRAJAN Czarter województwo kujawsko-pomorskie, REGION 1",KUJAWSKO-POMORSKIE,Odolion,Okrężna,28,87-700,536940
„SETA” – Jakub Jasiński,Dywersyfikację działalności i wprowadzenie nowych usług w firmie Seta – Jakub Jasiński w celu zwiększenie odporności branży gastronomicznej w województwie zachodniopomorskim na negatywne skutki zewnętrzne,ZACHODNIOPOMORSKIE,Szczecin,Aleja Wojska Polskiego,29,70-473,424919.32
D.P.S. SPÓŁKA Z OGRANICZONĄ ODPOWIEDZIALNOŚCIĄ SPÓŁKA KOMANDYTOWA,Rozwój i dywersyfikacja działalności DPS Sp. z o.o. Sp. k. w regionie zachodniopomorskim poprzez wprowadzenie do oferty nowych usług gastronomicznych - obwoźnej sprzedaży lodów rzemieślniczych Eccolo,ZACHODNIOPOMORSKIE,Szczecin,Andrzeja Struga,15,70-777,413993.1
ICC BARTOSZ GURZĘDA,Podniesienie odporności przedsiębiorstwa ICC Bartosz Gurzęda na sytuacje kryzysowe w wyniku rozszerzenia i dywersyfikacji prowadzonej działalności (REGION 1: województwo pomorskie),POMORSKIE,Reda,Olchowa,59,84-240,338450.44
Nautika Waldemar Sikora,"Rozszerzenie profilu działalności o wejście na rynek organizatorów turystyki, wdrożenie oferty dużej sali zabaw oraz dmuchanych zamków, a także rozszerzenie oferty produktowej o lody włoskie oraz amerykańskie. Przedsięwzięcie prowadzone będzie z uwzględnieniem zasad równościowych, polityk horyzontalnych, a także zielonego ładu oraz digitalizacji branży. Działanie nastawione jest na zwiększenie odporności biznesu na potencjalne przyszłe kryzysy. - woj. zachodniopomorskie (Region 1).",ZACHODNIOPOMORSKIE,Darłowo,Wczasowa,2,76-156,235636.08
"Usługi Gastronomiczne ""Stolik"" Andrzej Jankowski","Dywersyfikacja działalności firmy Usługi Gastronomiczne ""Stolik"" Andrzej Jankowski w województwie zachodniopomorskim",ZACHODNIOPOMORSKIE,Szczecin,Gwarna,66,70-789,104065.2
FUNDACJA GOTORUŃ,Zwiększenie odporności na sytuacje kryzysowe Fundacji GOTORUŃ poprzez dywersyfikację i wprowadzenie nowej usługi do działalności w województwie kujawsko – pomorskim.,KUJAWSKO-POMORSKIE,Toruń,Tadeusza Kościuszki,54,87-100,129632.93
SPÓŁA SABINA BRZOSKOWSKA," RAFAŁ BRZOSKOWSKI SPÓŁKA CYWILNA,Zwiększenie odporności przedsiębiorstwa SPÓŁA SABINA BRZOSKOWSKA, RAFAŁ BRZOSKOWSKI SPÓŁKA CYWILNA na sytuacje kryzysowe w wyniku dywersyfikacji prowadzonej działalności (REGION 1: województwo pomorskie)",POMORSKIE,Gdańsk,Bitwy Oliwskiej,34,80-339,222082.42
"HOTEL KISTON SPÓŁKA Z OGRANICZONĄ ODPOWIEDZIALNOŚCIĄ (dawniej PRZEDSIĘBIORSTWO PRODUKCYJNO-USŁUGOWE ""TRÓJBET"" SPÓŁKA Z OGRANICZONĄ ODPOWIEDZIALNOŚCIĄ)","Rozszerzenie i dywersyfikacja usług świadczonych przez Hotel Kiston w oparciu o nowe i rozszerzone usługi, a także inwestycje w rozwiązania cyfrowe, proekologiczne i usługi rozwojowe podnoszące konkurencyjność firmy, zwiększające jej odporność na wypadek kolejnych kryzysów - realizowane w woj. pomorskim - Region 1",POMORSKIE,Kistowo,,26,83-320,479193.19
AKADEMIA WSZECHSTRONNEGO ROZWOJU FUN COLLEGE,"Dywersyfikacja działalności AKADEMIA WSZECHSTRONNEGO ROZWOJU FUN COLLEGE prowadzącego działalności w województwie zachodniopomorskim, poprzez wprowadzenie nowej i ulepszonej usługi, w celu zwiększenia odporności przedsiębiorstwa na sytuacje kryzysowe, realizowana w Regionie 1: kujawskopomorskie, pomorskie, zachodniopomorskie",ZACHODNIOPOMORSKIE,Stargard,Spółdzielcza,11,73-110,525973.52
KASZUBSKIE CENTRUM KONGRESOWE SPÓŁKA Z OGRANICZONĄ ODPOWIEDZIALNOŚCIĄ,"Inwestycja w celu uruchomienia nowych usług związanych ze SPA, siłownią zewnętrzną, wypożyczalnią rowerów, wirtualnym przewodnikiem turystycznym oraz organizacją konferencji tematycznych",POMORSKIE,Szymbark,Szymbarskich Zakładników,12,83-315,537634.69
HENRYK KOSTUCH U CHŁOPA,Inwestycje w nowe usługi u Chłopa,POMORSKIE,Chmielno,Wiejska,1,83-333,507393.14
RMS Company Ramus Patryk,"Zwiększenie odporności RMS COMPANY PATRYK RAMUS z województwa kujawsko-pomorskiego (Rejon 1) na sytuacje kryzysowe poprzez otwarcie punktu gastronomicznego kuchni azjatyckiej i sushi w nowej lokalizacji (Niemcz, gm. Osielsko), rozszerzenie oferty produktowej w oparciu o PKD 56.10A oraz zdywersyfikowanie zakresu działalności o catering w oparciu o PKD 56.21.Z",KUJAWSKO-POMORSKIE,Bydgoszcz,Toruńska,76,85-023,539738.54
PRZEMYSŁAW MATECKI MOON,Rozszerzenie oferty wynajmu apartamentów o salon masażu w województwie Pomorskim,POMORSKIE,Kraków,Balicka,12a,30-149,106111.23
KARO Handel i usługi Karolina Przybyszewska,Dywersyfikacja firmy o działalność związaną z centrum relaksu w województwie Pomorskim,POMORSKIE,Gdańsk,Królewskie Wzgórze,28,80-283,497655
"RESTAURACJA ""GOSIA""- Małgorzata Frankowska",Inwestycje związane z organizacją eventów dla rodzin oraz wykorzystaniem odnawialnych źródeł energii,POMORSKIE,Kielno,Oliwska,97,84-208,507825.06
ZOMAX Aleksandra Aszyk,Dywersyfikacja i uodpornienie na przyszłe kryzysy firmy Zomax Aleksandra Aszyk działającej w regionie pomorskim,POMORSKIE,Reda,Morelowa,1,84-240,538893.43
"WITOLD GULCZ ""MY FLY""",Rozszerzenie działalności MY FLY o całkowicie nową usługę wynajmu domków nad jeziorem - woj. Pomorskie - Region 1,POMORSKIE,Gdańsk,Przywidzka,7,80-174,539904.93
ArtHouse Spółka z ograniczoną odpowiedzialnością,"Dywersyfikacja działalności ArtHouse Sp. z o. o. w celu osiągnięcia większej odporności i konkurencyjności na rynku, poprzez rozwój nowych usług zakwaterowania i gastronomii w Regionie 1 - województwa kujawsko-pomorskie, pomorskie, zachodniopomorskie w ramach Programu Krajowego Planu Odbudowy i Zwiększania Odporności, Inwestycja 1.2.1 Inwestycje dla przedsiębiorstw w produkty, usługi i kompetencje pracowników oraz kadry związane z dywersyfikacją działalności.",ZACHODNIOPOMORSKIE,Ustronie Morskie,Bolesława Chrobrego,60,78-111,539903.37
BART-POL Bartosz Schweitzer,Rozszerzenie działalności restauracji Boston Rewal o nowe usługi cateringowe - region zachodniopomorski.,ZACHODNIOPOMORSKIE,Rewal,Saperska,4,72-344,509062.57
GRUPA WESTA SPÓŁKA Z OGRANICZONĄ ODPOWIEDZIALNOŚCIĄ,Rozszerzenie działalności spółki GRUPA WESTA poprzez stworzenie strefy relaksu w ośrodku Moderna w województwie pomorskim,POMORSKIE,Gdynia,pl. Kaszubski,8,81-350,535163.26
GASTRO-TOUR Jarosław Ruta,Dywersyfikacja działalności i wprowadzenie nowej usługi w Ośrodku Kolonijno Wczasowym w celu zwiększenie odporności branży hotelarskiej w województwie zachodniopomorskim na negatywne skutki zewnętrzne,ZACHODNIOPOMORSKIE,Gryfice,Warszawska,27,72-300,526083.2
A&M Firma eventowo-szkoleniowa Małgorzata Robaczek,Rozwój miejsc krótkotrwałego zameldowania oraz wprowadzenie usług związanych z poprawą kondycji fizycznej,POMORSKIE,Nowa Wieś Malborska,Platynowa,26,82-200,101241
CALISTHENICS ACADEMY SPÓŁKA Z OGRANICZONĄ ODPOWIEDZIALNOŚCIĄ,"Inwestycja w dywersyfikację działalności przedsiębiorstwa CALISTHENICS ACADEMY SPÓŁKA Z OGRANICZONĄ ODPOWIEDZIALNOŚCIĄ poprzez wprowadzenie nowej usługi w zakresie organizacji spotkań, konferencji, wystaw polegająca na uruchomieniu centrum konferencyjnego w regionie 1 (kujawsko-pomorskie)",KUJAWSKO-POMORSKIE,Bydgoszcz,Gdańska,135,85-022,412860
"KAWIARNIA ""FINEZJA"" MAŁGORZATA SKODDA-REONTZKA"," MARIKA SKODDA,Dywersyfikacja, rozszerzenie i zwiększenie odporności przedsiębiorstwa na sytuacje kryzysowe poprzez wprowadzenie nowych usług – KAWIARNIA ""FINEZJA"" MAŁ- GORZATA SKODDA-REONTZKA, MARIKA SKODDA - Region Zachodniopomorski",ZACHODNIOPOMORSKIE,Szczecin,Ku Słońcu,25D,71-073,296597.94
DUBROVNIK SPÓŁKA Z OGRANICZONĄ ODPOWIEDZIALNOŚCIĄ,"Inwestycje dla DUBROVNIK SPÓŁKA Z OGRANICZONĄ ODPOWIEDZIALNOŚCIĄ w produkty, usługi i kompetencje pracowników oraz kadry związane z dywersyfikacją działalności",ZACHODNIOPOMORSKIE,Warszawa,Nowogrodzka,22,00-511,540000
Classic Sound Adrian Michalski,Wdrożenie nowej usługi organizacji i obsługi kongresów w formule online oraz hybrydowej przez firmę Classic Sound Adrian Michalski,KUJAWSKO-POMORSKIE,Niemcz,Krabowa,7,86-032,344388.37
GASTROTRAILERS ŁUKASZ PIETRZAK,"Rozszerzenie i dywersyfikacja działalności, zwiększenie konkurencyjności i innowacyjności firmy poprzez wprowadzenie nowych usług i pozyskiwanie nowych klientów. Wzmocnienie odporności na kryzysy dzięki zielonej transformacji oraz zastosowaniu nowoczesnych technologii cyfrowych, podnoszenie kompetencji pracowników oraz świadczenie usług doradczych w zakresie dywersyfikacji. Dostosowanie do aktualn",KUJAWSKO-POMORSKIE,Kruszwica,Poznańska,16,88-150,485866.8
"ALICJA GULCZ ""ORANGE TOUR""",Rozszerzenie oraz uodpornienie na sytuacje kryzysowe Firmy ORANGE TOUR poprzez wprowadzenie nowej usługi wynajmu domków woj. Pomorskie - Region 1,POMORSKIE,Szczerbięcin,,2,81-113,539322.21
BEZ PATENTU ŁUKASZ ZACHARCZYK,"Zwiększenie konkurencyjności firmy poprzez rozszerzenie zakresu usług o wynajem ekologicznego domku na wodzie tak zwanego houseboata. Obszar działania : województwo pomorskie , Pętla Żuławska i Zatoka Gdańska",POMORSKIE,Błotnik,Nadwiślańska,2,83-020,327523.5
STANGIEL SPÓŁKA Z OGRANICZONĄ ODPOWIEDZIALNOŚCIĄ,Wdrożeniu innowacyjnej usługi interaktywnej edukacji sportowej na kortach do squasha. Region 1. woj. pomorskie.,POMORSKIE,Kowale,Zeusa,84,80-180,538475.04
MARMAT MARCIN PILIMAN,Dywersyfikacja usług działalności w branży gastronomicznej firmy MARMAT MARCIN PILIMAN w zachodniopomorskim,ZACHODNIOPOMORSKIE,Szczecin,Jarogniewa,30,71-664,509608
ROMA S.C. ROBERT PETTERSEN," MATEUSZ SOBCZYK,Dywersyfikacja, rozszerzenie i zwiększenie odporności przedsiębiorstwa na sytuacje kryzysowe poprzez wprowadzenie nowych usług – ROMA S.C. ROBERT PETTERSEN, MATEUSZ SOBCZYK - Region Zachodniopomorski",ZACHODNIOPOMORSKIE,Szczecin,Bieszczadzka,43,71-042,536333.34
"Paweł Jajkowski HOTEL ""PEKIN"" I RESTAURACJA CHIŃSKA ""PEKIN""; PRZEDSIĘBIORSTWO HANDLU ZAGRANICZNEGO ""PEKIN""","Utworzenie Centrum Nurkowego Diving Dragons (region 1, woj. pomorskie)",POMORSKIE,Władysławowo,Niepodległości,14,84-120,537743.7
BURSZTYNOWA Centrum Konferencyjno-Bankietowe Ryszard Bartoszek,"Zwiększenie odporności przedsiębiorstwa pod firmą ""BURSZTYNOWA"" Centrum Konferencyjno-Bankietowe Ryszard Bartoszek na sytuacje kryzysowe poprzez rozszerzenie i dywersyfikację działalności gastronomicznej prowadzonej w istniejącym obiekcie o restaurację otwartą dla gości przez cały tydzień wraz z ogródkiem gastronomicznym, placem zabaw i atrakcjami dla dzieci oraz wprowadzenie usług kateringowych",ZACHODNIOPOMORSKIE,Pełczyce,Pełczyk,1,73-260,241027.2
„Happy Sport” Krzysztof Wesołowski,"Zwiększenie odporności firmy Happy Sport na sytuacje kryzysowe poprzez dywersyfikację usług, które pozwolą wejść w nowe obszary działalności w województwie pomorskim",POMORSKIE,Gdańsk,Niedźwiednik,8a,80-892,531945
DOMINIK BORATYŃSKI,Wielki odpoczynek w Cedrach Małych - poprawa odporności i dywersyfikacja działalności przedsiębiorstwa DOMINIK BORATYŃSKI poprzez wprowadzenie nowej usługi – zakwaterowania w domkach mobilnych w województwie pomorskim (Region 1),POMORSKIE,Cedry Małe,Miodowa,5,83-020,305411.94
THAO THAI RESTAURANT Spółka z ograniczoną odpowiedzialnością,"Rozszerzenie i dywersyfikacja działalności Thao Thai Restaurant Sp. z o. o. poprzez budowę trzech energooszczędnych budynków rekreacji indywidualnej z przeznaczeniem na usługi turystyczne w Sasinie (gmina Choczewo, województwo pomorskie).",POMORSKIE,Gdynia,Żaglowa,68,81-578,540000
"Anna Sorbian Zakład Opieki Stomatologicznej ""Dental-Rondo""","Wzmocnienie konkurencyjności oraz odporności na sytuacje kryzysowe przedsiębiorstwa Anna Sorbian Zakład Opieki Stomatologicznej ""Dental-Rondo"" poprzez unowocześnienie bazy usługowej i dywersyfikację działalności w Gdańsku w województwie pomorskim.",POMORSKIE,Gdańsk,Myśliwska,61,80-283,503219
SAN SPÓŁKA Z OGRANICZONĄ ODPOWIEDZIALNOŚCIĄ,Rozszerzenie działalności firmy San Sp. z o.o. w Kołobrzegu poprzez świadczenie nowej usługi kateringowej i unowocześnionej usługi masażu relaksacyjnego – jako element zwiększenia jej odporności na sytuacje kryzysowe (Region 1 – województwo zachodniopomorskie),ZACHODNIOPOMORSKIE,Kołobrzeg,Jana Kasprowicza,17,78-100,539992.8
VILLA GEMINI WIESŁAW KWIATKIEWICZ,"Zwiększenie odporności przedsiębiorstwa pod firmą Villa Gemini Wiesław Kwiatkiewicz na sytuacje kryzysowe poprzez rozszerzenie i dywersyfikację działalności polegające na wprowadzeniu do oferty nowej usługi turystycznej w postaci organizacji turnusów rekreacyjnych dla seniorów, ze szczególnym uwzględnieniem potrzeb osób z niepełnosprawnościami oraz usługi gastronomicznej w formie pizzerii, która oferować będzie pizzę na miejscu w lokalu oraz na wynos. Region 1.",ZACHODNIOPOMORSKIE,Mielno,Stefana Żeromskiego,1,76-032,538875
ESPRO Sebastian Protasiewicz,Dywersyfikacja działalności gastronomicznej poprzez świadczenie dodatkowych usług z własnej produkcji lodów w Koszalinie w województwie zachodniopomorskim,ZACHODNIOPOMORSKIE,Koszalin,Wenedów,6b,75-847,476865
STOWARZYSZENIE ABSOLWENTÓW AKADEMII MORSKIEJ W GDYNI,Dywersyfikacja i rozszerzenie działalności STOWARZYSZENIE ABSOLWENTÓW AKADEMII MORSKIEJ W GDYNI region POMORZE,POMORSKIE,Gdynia,Morska,81-87,81-225,520331.79
"OŚRODEK WCZASOWO-SANATORYJNY ""STOCZNIOWIEC"" SPÓŁKA Z OGRANICZONĄ ODPOWIEDZIALNOŚCIĄ","Zwiększenie odporności Ośrodka Wypoczynkowo - Sanatoryjnego ""Stoczniowiec"" Sp. z o. o. na sytuacje kryzysowe w wyniku rozszerzenia prowadzonej działalności o rodzinne imprezy okolicznościowe oraz udostępnienie sali restauracyjnej (Region 1 województwo zachodniopomorskie)",ZACHODNIOPOMORSKIE,Pogorzelica,Leonida Teligi,1,72-351,537000
MIROSŁAW SOCHA Przedsiębiorstwo Produkcyjno-Handlowo-Usługowe ,",SOMBUD"",Rozszerzenie działalności PPHU SOMBUD w regionie 1 -pomorskim",POMORSKIE,Somonino,Ceramiczna,1A,83-314,462192.33
"Restauracja ""Trzy Korony"" Andrzej Labudda",Rozszerzenie oferty o stanowiska gastronomiczne na imprezach miejskich oraz otwarcie wypożyczalni rowerów w województwie pomorskim.,POMORSKIE,Wejherowo,Jana III Sobieskiego,296,84-200,88954.41
Janusz Margański PPH MARTECH,Rozwój oferty turystycznej Pałacu Popowo,KUJAWSKO-POMORSKIE,Sikorowo,,73,88-100,419800.02
ATAREST SPÓŁKA Z OGRANICZONĄ ODPOWIEDZIALNOŚCIĄ,Rozszerzenie działalności firmy ATAREST Sp. z o.o. poprzez uruchomienie w prowadzonym przez nią hotelu ogrodowej strefy odpoczynku z zewnętrznym mini SPA i wprowadzenie automatycznego serwisu barowego i kawowego celem dywersyfikacji działalności i wzmocnienia odporności firmy w regionie kujawsko-pomorskim.,KUJAWSKO-POMORSKIE,Golub-Dobrzyń,PTTK,21,87-400,308689.37
FIRFEK Rafał Firfas,"Dywersyfikacja działalności ""FIRFEK"" Rafał Firfas w ramach wsparcia sektora HoRe Ca dla przedsiębiorstw z regionu kujawsko-pomorskiego.",KUJAWSKO-POMORSKIE,Bydgoszcz,ks. Ignacego Skorupki,61,85-156,539900.09
ITRICH Transport i Paliwa BOGDAN ITRICH,EkoRowerownia - uruchomienie wypożyczalni rowerów elektrycznych na terenie województwa pomorskiego,POMORSKIE,Rzepnica,Ks. Jerzego Popiełuszki,11,77-100,455116.07
SECESJA NIERUCHOMOŚCI EWA LATOWSKA,"Rozszerzenie działalności firmy ""SECESJA"" NIERUCHOMOŚCI EWA LATOWSKA, Bistro Katarzynka z województwa kujawsko-pomorskiego o nową usługę organizacji spotkań i konferencji z obsługą cateringową",KUJAWSKO-POMORSKIE,Toruń,św. Katarzyny,6,87-100,539624.7
FARMA SPÓŁKA Z OGRANICZONĄ ODPOWIEDZIALNOŚCIĄ,Dywersyfikacja działalności spółki Farma prowadzącej działalność w województwie pomorskim poprzez wprowadzenie do oferty spółki aplikacji do rezerwowania lokali oraz usługi organizacji projekcji filmów w formie kina letniego.,POMORSKIE,Gdańsk,Korzenna,33,80-851,228222
INSTYTUT ZDROWIA KORAL-LIVE SPÓŁKA Z OGRANICZONĄ ODPOWIEDZIALNOŚCIĄ,Inwestycje dla INSTYTUT ZDROWIA KORAL-LIVE SPÓŁKA Z OGRANICZONĄ ODPOWIEDZIALNOŚCIĄ w produkty i usługi,ZACHODNIOPOMORSKIE,Kołobrzeg,Tadeusza Kościuszki,12,78-100,538591.5
Aleksandra Wiśniewska,Wzrost odporności przedsiębiorstwa Aleksandra Wiśniewska na sytuacje kryzysowe poprzez dywersyfikację działalności i wdrożenie nowej usługi mobilnego kina na otwartym powietrzu na terenie regionu województwa kujawsko-pomorskiego,KUJAWSKO-POMORSKIE,Bydgoszcz,Człuchowska,13,85-808,540000
The Royal Sport Management Sp ZOO,"Wzmocnienie odporności oraz potencjału rozwojowego Firmy The Royal Sport Management poprzez dywersyfikację działalności w obszarze organizacji targów, wystaw i kongresów branżowych na terenie województwa zachodniopomorskiego",ZACHODNIOPOMORSKIE,Szczecin,Aleja Piastów,54,70-311,525446.1
Firma Handlowo-Usługowa Szymon Wołoszyk,Zwiększenie odporności i konkurencyjności firmy “Firma Handlowo-Usługowa Szymon Wołoszyk” na sytuacje kryzysowe w wyniku dywersyfikacji prowadzonej działalności: REGION 1 - województwo pomorskie.,POMORSKIE,Zelgoszcz,Księdza Bony,12,83-208,147128.41
HOTEL JANTAR ĆWIGOŃ I WSPÓLNICY SPÓŁKA JAWNA,Rozszerzenie działalności Hotelu Jantar w regionie 1 -pomorskim,POMORSKIE,Ustka,Wczasowa,14,76-270,506445.7
Olimpijczyk Marlena Kalinowska,"Ekspansja oraz dywersyfikacja zajęć sportowych i rekreacyjnych w Zachodniopomorskiem: Inwestycje w zdrowie i nowoczesne rozwiązania dla lokalnej społeczności w tym organizacja sportowych eventów plenerowych i wypożyczenie sprzętu rekreacyjnego,ZACHODNIOPOMORSKIE,Szczecin,Gwarna,46,70-789,514827.04
P.H.U ANDREW Andrzej Kuchtyn,Rozszerzenie oraz dywersyfikacja działalności firmy PHU Andrew Andrzej Kuchtyn poprzez wprowadzenie nowej usługi ,zwiększenie odporności na sytuacje kryzysowe Zakup łodzi żaglowej Rejon 1,ZACHODNIOPOMORSKIE,Bogacica,Konopnickiej,4f,46-243,424500
P.H.U. Beata Golińska,Udzielenie pomocy finansowej na przedsięwzięcie MŚP prowadzących mikro, małych i średnich przedsiębiorstwom prowadzącym działalność w sektorze hotelarstwo, gastronomii, turystyki lub kultury na realizację MŚP w ramach inwestycji A1.2.1 KPO z regionu nr 1 obejmującego województwa:kujawsko-pomorskie, pomorskie i zachodniopomorskie.,ZACHODNIOPOMORSKIE,Szczecin,Waleriana Łukasińskiego,42d,71-215,92841.3
Wanted Grzegorz Latoszewski,Rozwój usług turystycznych sposobem na podniesienie odporności na sytuacje kryzysowe oraz dywersyfikację przychodów w firmie Wanted Grzegorz Latoszewski wraz podniesieniem jakości usług turystycznych w woj. Pomorskim.,POMORSKIE,Koszalin,Podlaska,43,75-396,506388.79
NESTARTO Spółka cywilna, Dawid Stramowski, Iwona Wencka-Stramowska,„Dywersyfikację działalności i wprowadzenie nowej usługi w Hotelu Rozmaryn i Lawenda w celu zwiększenie odporności branży gastronomicznej i hotelarskiej w województwie kujawsko - pomorskim na negatywne skutki zewnętrzne”,KUJAWSKO-POMORSKIE,Ślesin,Nakielska,1A,89-121,538257.41
Jolanta Tomczewska,Dywersyfikacja działalności poprzez rozbudowanie usługi gastronomicznej wzbogacającej usługi zakwaterowania w Starym Folwarku w miejscowości Radowo Małe w województwie zachodniopomorskim oraz catering zewnętrzny w pierogarni w miejscowości Łobez w województwie zachodniopomorskim,ZACHODNIOPOMORSKIE,Radowo Małe,,10,72-314,316003.86
Rafał Chojnacki ARTICO, 369TEAM Agencja Eventowa,Dywersyfikacja oferty firmy Rafał Chojnacki ARTICO, 369TEAM Agencja Eventowa z m. Torunia celem zwiększenia odporności prowadzonej działalności gospodarczej na sytuacje kryzysowe,KUJAWSKO-POMORSKIE,Toruń,Żółkiewskiego,37,87-100,540000
Zajazd Rytkówka"" Katarzyna Rytka,„Rozszerzenie oferty usługowej Zajazdu ""Rytkówka"" położonym w Obrowie w województwie kujawsko-pomorskim w celu rozwoju firmy oraz zwiększenia jej odporności na pojawiające się sytuacje kryzysowe.”",KUJAWSKO-POMORSKIE,Obrowo,Szkolna,39,87-126,473356.06
Euro Lider Group Spółka z ograniczoną odpowiedzialnością,Rozszerzenie działalności Spółki o ofertę mobilnych miejsc noclegowych i wypożyczalnie sprzętów wodnych w atrakcyjnych lokalizacjach w regionie pomorskim,POMORSKIE,Gdynia,Wzgórze Bernadowo,301,81-583,532871.55
ZROLLSOWANI MAŁGORZATA GÓRECKA,Zwiększenie odporności przedsiębiorstwa ZROLLSOWANI Małgorzata Górecka poprzez dywersyfikację sposobu świadczenia usług oraz wprowadzenie nowych produktów w województwie kujawsko-pomorskim.,KUJAWSKO-POMORSKIE,Włocławek,Wesoła,6,87-700,205577.63
